Test Name,Year,Session,Subject,Number,Question,Question_image,Option 1,Option 2,Option 3,Option 4,Option 5,Answer
산업안전지도사,2013,1,산업안전일반,28,"A 회사의 검사자는 이산적 직무인 부품의 내경검사 작업을 하루에 300개씩 실시하고 있다. 이 중에서 불량품을 10개 발견하여 290개를 원청회사에 납품하였고, 원청회사에서의 입고검사에서 30개가 더 발견되었다고 통보가 왔다. 원청회사에서의 검사가 완벽하다고 가정할 경우 이 검사자의 인간신뢰도(human reliability)는 얼마인가?(단, 소수점 셋째 자리에서 반올림한다.)",,0.1,0.13,0.87,0.9,0.93,4
산업안전지도사,2013,1,산업안전일반,29,신뢰성시험에 있어 가속수명시험에 관한 설명으로 옳은 것은?,,"가속수명시험시간이 와이블(Weibull) 분포를 따르는 경우, 가속계수의 값만 알면 가속시험 데이터에서 구한 평균고장률로부터 정상조건에서의 평균고장률을 구할 수 있다.","가속시험 데이터가 대수정규분포를 따른다면, 가속시험 때와 정상시험 때의 형상모수는 다르게 되므로 형상모수에 가속계수를 곱하여야 한다.",주기적으로 스트레스를 증가시키면서 가급적 모든 샘플이 고장이 날 때까지 행하는 가속수명시험을 계단형 스트레스(step stress) 시험이라 한다.,온도 외에 전압 또는 습도 등 다른 스트레스까지 포함시킨 모델로는 아레니우스(Arrhenius) 모델이 있다.,스트레스로서 온도만을 고려하는 대표적인 모델로는 아이링(Eyring) 모델이 있다.,3
산업안전지도사,2013,1,산업안전일반,30,다음은 결함수분석(FTA)법에 의한 재해 사례 연구에 관한 내용이다. 연구 절차를 올바른 순서대로 나열한 것은?\nㄱ. 문제점의 중요도 및 우선순위를 결정한다.\nㄴ. 톱(top)사상의 재해원인을 결정한다.\nㄷ. 전체의 결함수(FT)도를 완성한다.\nㄹ. 안전성이 있는 개선안을 검토하고 결정한다.,,ㄱ → ㄴ → ㄷ → ㄹ,ㄱ → ㄷ → ㄴ → ㄹ,ㄴ → ㄱ → ㄷ → ㄹ,ㄴ → ㄱ → ㄹ → ㄷ,ㄷ → ㄱ → ㄹ → ㄴ,1
산업안전지도사,2013,1,산업안전일반,31,"A 회사에서 생산하는 전자부품의 전자회로는 시스템의 안전을 위하여 그림과 같이 5개의 부품 중 3개만 작동하면 시스템이 정상적으로 가동되는 구조를 갖추고 있다. 동일하고 상호독립적인 각 부품의 고장률을 λ라고 할 때, 다음 중 신뢰도를 구하는 모델로 옳은 것은?",O,$R(t) = \sum_{3}^{5} \binom{5}{3} [e^{-\lambda t}]^3 [1-e^{-\lambda t}]^2$,$R(t) = \sum_{3}^{4} \binom{4}{3} [e^{-\lambda t}]^4 [1-e^{-\lambda t}]^3$,$R(t) = \sum_{5}^{3} \binom{3}{5} [e^{-\lambda t}]^3 [1-e^{-\lambda t}]^5$,$R(t) = \sum_{3}^{5} \binom{5}{3} [e^{-\lambda t}]^5 [1-e^{-\lambda t}]^3$,$R(t) = \sum_{3}^{5} \binom{5}{3} [e^{-\lambda t}]^5 [1-e^{-\lambda t}]^2$,1
산업안전지도사,2013,1,산업안전일반,32,"파레토(Pareto)도에 대한 설명으로 옳은 것만을 모두 고른 것은?\nㄱ. 가로축에는 항목별 막대그래프를 왼쪽부터 큰 순서로 기입하고, 세로축에는 그 비율을 나타내는 도표이다.\nㄴ. 데이터를 재해 원인별 혹은 현상별로 분류하여 막대그래프와 누적 꺾은선 그래프를 함께 표시한 도표이다.\nㄷ. 여러 가지 원인 및 대책에 있어서 집중적으로 관리하여야 하는 대상을 선정하기에 편리하다.",,ㄱ,"ㄱ, ㄴ","ㄱ, ㄷ","ㄴ, ㄷ","ㄱ, ㄴ, ㄷ",5
산업안전지도사,2013,1,산업안전일반,33,안전과 위험에 대한 개념 설명으로 옳지 않은 것은?,,안전이란 재해와 위험이 없는 바람직한 상태에 도달하는 것을 말한다.,재해가 발생하는 것은 위험에 의한 결과적인 현상을 말한다.,위험이란 근로자가 작업장소에서 접촉하는 물건 또는 환경과의 상호관계를 나타내는 것으로 그 결과로 부상이 발생하는 것이다.,안전에 대응하는 반대 개념은 재해가 발생하는 것이다.,"안전은 상해, 손실, 위해 또는 위험에 노출되는 것으로부터의 자유를 말한다.",4
산업안전지도사,2013,1,산업안전일반,34,안전교육의 3단계 중에서 2단계에 해당되는 교육과 그 특성을 올바르게 나타낸 것은?,,안전기능교육 : 습관과 형성,안전기능교육 : 경험과 적응,안전지식교육 : 습득과 전달,안전지식교육 : 경험과 적응,안전태도교육 : 습관과 형성,2
산업안전지도사,2013,1,산업안전일반,35,C/R비(Control-Response Ratio)에 관한 설명으로 옳지 않은 것은?,,C/R비의 값은 화면상의 이동거리와는 반비례한다.,C/R비의 값이 크다는 것은 조종장치가 민감하다는 의미이다.,인간-기계시스템을 설계할 때에는 조종장치의 이동시간과 조종시간을 고려해야 한다.,C/R비의 값이 작으면 조종장치의 조종시간이 많이 소요되고 이동시간은 적게 소요된다.,C/R비는 모니터를 보면서 조종장치를 사용하는 작업에 적용한다.,2
산업안전지도사,2013,1,산업안전일반,36,재해 발생 관련 이론에 관한 설명으로 옳은 것은?,,"자베타키스(Zabetakis)의 사고연쇄성이론 5단계 중에서 2단계는 '작전적 에러'이고, 3단계는 '전술적 에러'이다.","웨버(Weaver)의 사고연쇄성이론 5단계 중에서 2단계는 '인간의 결함'을 정의하고, '무엇이 재해를 일으켰는지'를 찾으려고 하는 것이다.",아담스(Adams)의 사고연쇄성이론 5단계 중에서 3단계는 '에너지 및 위험물의 예기치 못한 폭주'이다.,버드(Bird)의 사고연쇄성이론 5단계 중에서 1단계는 '사회적 환경과 유전적 요소'이다.,하인리히(Heinrich)의 재해발생이론에서 1단계는 '제어의 부족'이다.,2
산업안전지도사,2013,1,산업안전일반,37,안전교육방법에 관한 설명으로 옳은 것은?,,"ATT(American Telephone & Telegram Co.)는 대상 계층이 한정되어 있고, 먼저 훈련을 받은 자는 직급에 관계없이 훈련을 받지 않은 자에 대하여 지도자가 될 수 있다.",OJT(On the Job Training)는 외부 전문가를 강사로 초빙하여 직장의 설정에 맞게 실제적 훈련이 가능하다.,Off JT(Off the Job Training)는 훈련에만 전념하게 하고 교육훈련목표에 대해 집단적 노력을 모을 수 있다.,"TWI(Training Within Industry)는 주로 제일선 감독자를 교육대상자로 하며 교육내용은 작업방법훈련, 작업지도훈련, 인간관계훈련, 작업안전훈련이 있다.","MTP(Management Training Program)는 TWI 보다 약간 낮은 계층을 목표로 하고, TWI와는 달리 관리문제에 보다 더 치중하고 있다.",4
산업안전지도사,2013,1,산업안전일반,38,조명에 관한 용어의 설명으로 옳지 않은 것은?,,광도(luminous intensity)는 단위 입체각당 광원에서 방출되는 광속으로 측정한다.,휘도(luminance)는 단위 면적당 표면에서 반사 또는 방출되는 빛의 양을 말한다.,조도(illuminance)는 어떤 물체의 표면에서 내는 빛의 양을 말한다.,반사율(reflectance)은 휘도와 조도의 비를 말한다.,대비(luminance contrast)는 과녁의 휘도와 배경의 휘도 차를 말한다.,3
산업안전지도사,2013,1,산업안전일반,39,NIOSH 들기지침에 관한 설명으로 옳지 않은 것은?,,"OWAS, RULA, REBA 등이 평가기법으로 사용된다.","초기에는 양손 대칭 작업에만 적용할 수 있었으나, 그 이후에는 비대칭작업, 커플링(coupling) 효과가 추가되었다.","이 가이드는 역학적(epidemiological), 생체역학적(biomechanical), 생리학적(physiological), 심물리학적(psychophysical) 기준에 근거하여 개발되었다.",권장무게한계(Recommended Weight of Limit)를 계산하여 제시하여 준다.,"들기작업지수(Lifting Index)를 계산하는데 LI는 실제 작업물의 무게와 권장무게한계의 비율이며, LI값이 1.0보다 작아야 안전하다.",1
산업안전지도사,2013,1,산업안전일반,40,다음 중 감성공학에 관한 설명으로 옳지 않은 것은?,,"사람의 느낌(이미지)을 고객이 요구하는 제품의 품질특성으로 변환시키고, 이를 물리적 설계요소로 번역시키는 기술이다.",일본의 스포츠카인 '미야타'는 최초의 감성공학 설계가 반영된 제품이다.,인간-기계시스템에서 인간과 기계 사이에 정보를 주고받는 휴먼인터페이스 설계가 주요 문제로 대두되고 있다.,소비자의 감성에 호소하는 제품을 설계하기 위해서 소비자의 감성적 특성을 반영하는 것이지 신체적 특성을 반영하는 것은 아니다.,"감성공학 기법으로는 기능전개형, 다변량해석형, 가상현실형이 있다.",4
산업안전지도사,2013,1,산업안전일반,41,"어떤 설비의 평균고장률이 0.0125회/시간이고, 이 설비에 고장이 발생하면 수리하는데 소요되는 평균시간은 40시간이라고 한다. 다음 설명 중 옳은 것은?(단, 사후보전만 실시한다.)",,이 설비의 평균수리율은 0.025회/시간이다.,이 설비의 가동성은 0.5 이다.,이 설비의 수명은 지수분포를 따르지 않는다.,이 설비를 평균수명만큼 사용한다면 고장이 발생하지 않을 확률은 약 63 % 이다.,"이 설비를 1,000시간 동안 사용한다면 평균 15회의 고장이 발생하며, 사후수리를 받게 된다.",1
산업안전지도사,2013,1,산업안전일반,42,"사상나무분석(ETA)에 대한 의사결정나무(decision tree)가 다음과 같을 때 A, B, C, D, E에 해당하는 값으로 옳지 않은 것은?",O,A = 0.9,B = 0.7,C = 0.216,D = 0.054,E = 0.9,5
산업안전지도사,2013,1,산업안전일반,43,고용노동부 고시「사업장 위험성평가에 관한 지침」에서의 위험성평가 방법으로 옳지 않는 것은?,,안전보건관리책임자는 위험성평가의 실시를 총괄 관리한다.,"안전관리자, 보건관리자는 위험성평가의 실시를 관리한다.","안전관리자, 보건관리자는 유해·위험요인의 파악, 위험성의 추정, 결정, 위험성 감소대책의 수립·실행을 한다.",해당 작업에 종사하는 근로자는 특별한 사정이 없는 한 해당 작업에 대한 유해·위험요인을 파악하거나 감소대책을 수립하는데 참여한다.,"기계·기구, 설비 등과 관련된 위험성평가에는 해당 기계·기구, 설비 등에 전문지식을 갖춘 사람을 참여시킨다.",3
산업안전지도사,2013,1,산업안전일반,44,"어떤 근로자가 빈 드럼통 위에 서서 구조물에 용접작업을 하던 중 용접불똥이 비산되어 열려있는 드럼통 속으로 들어가 잔류 가스가 폭발하였고, 이로 인하여 근로자가 3 m 아래로 떨어져 척추를 다쳤다. 다음 중 불안전한 행동에 해당하는 것은?",,작업 중에 드럼통 속으로 용접불똥이 튀어 들어갔다.,드럼통의 마개가 열려있는 채로 방치해 놓았다.,드럼통 속에 잔류 가스가 남아 있었다.,근로자가 3 m 아래로 떨어져 척추를 다쳤다.,드럼통 속의 내용물을 확인하지 않고 빈 드럼통 위에 서서 용접작업을 하였다.,5
산업안전지도사,2013,1,산업안전일반,45,고용노동부 고시「사업장 위험성평가에 관한 지침」에서의 위험성평가 인정신청에 대한 설명으로 옳은 것은?,,1년 중 사업수행 기간이 6개월 미만인 일시적인 사업 또는 계절사업을 하는 사업장은 인정신청을 할 수 있다.,건설업 중 잔여공사기간이 6개월 미만인 건설공사는 인정신청을 할 수 있다.,수급사업장이 산업안전보건법상 안전관리자 또는 보건관리자 선임대상인 경우에는 인정신청에서 수급사업장을 제외할 수 있다.,사업의 일부 또는 전부를 도급에 의하여 행하는 사업장은 도급사업장의 사업주가 수급사업장을 일괄하여 인정을 신청할 수 없다.,중대재해 등으로 인정이 취소된 날부터 1년이 경과하지 아니한 사업장이라도 인정신청을 할 수 있다.,3
산업안전지도사,2013,1,산업안전일반,46,교육심리학의 기본이론 중 학습지도의 원리에 해당하지 않는 것은?,,학습자 스스로 학습에 자발적으로 참여하여야 한다는 원리,학습은 계속 이루어져야 한다는 원리,학습자가 지니고 있는 각자의 요구와 능력 등에 알맞게 학습활동의 기회를 마련해 주어야 한다는 원리,학습을 총합적인 전체로 지도하자는 원리,구체적인 사물을 직접 제시하거나 경험을 통해 학습효과를 거둘 수 있다는 원리,2
산업안전지도사,2013,1,산업안전일반,47,"연평균근로자수가 250명인 A 사업장의 연간재해발생건수는 75건, 이로 인한 재해자수가 90명이고, 총휴업일수는 3,345일이 발생하였다. 이 사업장의 재해 통계에 대한 설명으로 옳은 것은?(단, 근로자는 1일 8시간씩 연간 280일을 근무하였다.)",,강도율은 5.97이다.,도수율은 160.71이다.,연천인율은 360이다.,종합재해지수는 29.92이다.,이 사업장에서 연천인율과 도수율과의 관계에는 2.4의 상수값이 적용된다.,3
산업안전지도사,2013,1,산업안전일반,48,교육훈련기법에 관한 설명으로 옳지 않는 것은?,,"강의법은 안전지식의 전달방법으로 초보적인 단계에서 효과가 큰 방법이며, 단시간에 많은 내용을 교육하는 경우에 적합하다.",시범은 어떤 기능이나 작업과정을 학습시키기 위해 필요로 하는 분명한 동작을 제시하는 방법이다.,반복법은 이미 학습한 내용이나 기능을 반복해서 이야기하거나 실연하도록 하는 방법이다.,토의법은 쌍방적 의사전달방식에 의한 교육으로 적극성·협동성을 기르는데 유효하다.,실연법은 실제의 장면이나 상태와 극히 유사한 상태를 인위적으로 만들어 그 속에서 학습하도록 하는 방법이다.,5
산업안전지도사,2013,1,산업안전일반,49,재해사례 연구방법의 각 단계를 올바르게 설명한 것은?,,'사실의 확인'은 파악된 사실로부터 기준에서 벗어난 문제점을 적출하고 그것이 문제로 된 이유를 분명히 한다.,"'문제점의 발견'은 문제점이 된 사실을 재해요인으로 분석, 검토하고 재해와 관계되는 영향의 정도를 평가한다.","'근본적 문제점의 결정'은 관리자, 감독자 및 작업자의 권한, 책임 및 직무로 보아 누가 할 것인가, 기준대로 하였는가를 평가하고 판단하여 결정한다.",'대책의 수립'은 문제점 가운데 재해의 중심이 된 사항과 재해원인을 결정하고 보고한다.,'대책의 수립'은 사례연구의 전제조건과 재해 상황의 주된 항목에 관하여 파악한다.,2
산업안전지도사,2013,1,산업안전일반,50,근로자 40명이 근무하는 사출성형제품 생산 공장에 가장 적합한 안전 조직은?,,안전관리의 계획부터 실시까지 모든 안전업무가 생산라인을 통해 직접적으로 적용되는 조직,"안전업무를 관장하는 참모를 두고, 안전관리 계획·조사·검토 등의 업무와 현장에 기술지원을 담당하도록 편성된 조직","안전업무 전담 참모를 두고, 생산라인에서도 부서장으로 하여금 안전업무를 수행하게 하는 조직",산업안전보건위원회를 활성화한 조직,정보수집과 사업장 특성에 적합한 안전기술 연구개발을 할 수 있는 조직,1
산업안전지도사,2013,1,기업진단·지도,51,프로젝트 관리에 활용되는 PERT(program evaluation & review technique)와 CPM(critical path method)의 설명으로 옳은 것은?,,"PERT는 개개의 활동에 대해 낙관적 시간치, 최빈 시간치, 비관적 시간치를 추정한 후 그들이 정규분포를 이룬다고 가정하여 평균기대 시간치를 구한다.",CPM은 프로젝트의 완성시간을 앞당기기 위해 최소비용법을 활용하여 주공정상에 위치하는 작업들의 비용관계를 분석하여 소요시간을 줄인다.,"과거자료나 경험을 기초로 한 PERT는 활동중심의 확정적 시간을 사용하고, 불확실한 작업을 기초로 한 CPM은 단계중심의 확률적 시간 추정치를 사용한다.",PERT/CPM은 활동의 전후 관계를 명확히 하고 체계적인 일정 및 예상통제로 효율적 진도관리를 위해 간트(Gantt)차트와 같은 도식적 기법을 활용한다.,PERT/CPM은 TQM(total quality management)과 연계되어 있어 제품 및 서비스에 대한 고객만족 프로세스를 지향하는 프로젝트 관리도구로 적합하다.,2
산업안전지도사,2013,1,기업진단·지도,52,"테일러(Taylor)의 과학적 관리법(scientific management)에 관한 설명으로 옳은 것만을 모두 고른 것은?\nㄱ. 부품을 표준화하고, 작업이 동시에 시작하여 동시에 끝나므로 동시관리라고도 한다.\nㄴ. 과업 중심의 관리로 인간의 심리적, 사회적 측면에 대한 문제의식이 부족하다.\nㄷ. 동일작업에 대하여 과업을 달성하는 경우 고임금, 달성하지 못하는 경우에는 저임금을 지급한다.\nㄹ. 작업을 전문화하고 전문화된 작업마다 직장(foreman)을 두어 관리하게 한다.\nㅁ. 작업환경에 관계없이 작업자의 동기부여가 작업능률을 증가시키는 결과를 보여주었다.",,"ㄱ, ㅁ","ㄷ, ㄹ","ㄴ, ㄷ, ㄹ","ㄴ, ㄹ, ㅁ","ㄱ, ㄷ, ㄹ, ㅁ",3
산업안전지도사,2013,1,기업진단·지도,53,재고의 기능에 따른 분류에 관한 설명으로 옳지 않은 것은?,,"안전재고 : 제품 수요, 리드타임 등의 불확실한 수요에 대비하기 위한 재고",분리재고 : 공정을 기준으로 공정전·후의 재고로 분리될 경우의 재고,"파이프라인 재고 : 공장에서 물류센터, 물류센터에서 대리점 등으로 이동 중에 있는 재고","투기재고 : 원자재 고갈, 가격인상 등에 대비하여 미리 확보해두는 재고",완충재고 : 생산 계획에 따라 주기적인 주문으로 주문기간 동안 존재하는 재고,5
산업안전지도사,2013,1,기업진단·지도,54,생산 시스템에 관한 설명으로 옳지 않은 것은?,,모듈생산시스템(MPS : modular production system)은 단납기화 요구강화와 원가절감을 위하여 부품 또는 단위의 조합에 따라 고객의 다양한 주문에 대응하는 생산 시스템이다.,"자재소요계획(MRP : material requirements planning)은 주일정계획(기준생산일정)을 기초로 하여 완제품 생산에 필요한 자재 및 구성부품의 종류, 수량 시기 등을 계획하는 시스템이다.","적시생산시스템(JIT : just in time)은 제품생산에 요구되는 부품 등 자재를 필요한 시기에 필요한 수량만큼 적기에 생산, 조달하여 낭비요소를 근본적으로 제거하려는 생산 시스템이다.","유연생산시스템(FMS : flexible manufacturing system)은 CAD, CAM 및 MRP 등의 기술을 도입, 생산 설비를 빠르게 전환하여 소품종 대량생산을 효율적으로 행하는 시스템이다.",셀생산시스템(CMS : cellular manufacturing system)은 숙련된 작업자가 컨베이어 라인이 없는 셀(cell) 내부에서 전체공정을 책임지고 완수하는 사람중심의 자율생산 시스템이다.,4
산업안전지도사,2013,1,기업진단·지도,55,임금관리 공정성에 관한 설명으로 옳은 것은?,,내부공정성은 노동시장에서 지불되는 임금액에 대비한 구성원의 임금에 대한 공평성 지각을 의미한다.,외부공정성은 단일 조직 내에서 직무 또는 스킬의 상대적 가치에 임금 수준이 비례하는 정도를 의미한다.,"직무급에서는 직무의 중요도와 난이도 평가, 역량급에서는 직무에 필요한 역량 기준에 따른 역량 평가에 따라 임금수준이 결정된다.","개인공정성은 다양한 직무 간 개인의 특질, 교육정도, 동료들과의 인화력, 업무 몰입수준 등과 같은 개인적 특성이 임금에 반영되는 정도를 의미한다.","조직은 조직구성원에 대한 면접조사를 통하여 자사 임금수준의 내부, 외부 공정성 수준을 평가할 수 있다.",3
산업안전지도사,2013,1,기업진단·지도,56,커뮤니케이션과 의사결정에 관한 설명으로 옳은 것은?,,"암묵지를 체계적, 조직적으로 형식지화한다고 하여도 의사결정의 가치창출 수준은 높아지지 않는다.","커뮤니케이션 효과를 높이기 위하여 메시지 전달자는 공식 서신, 전자우편, 전화, 직접 대면 등 다양한 방식 중 한 가지 방식에 집중할 필요가 있다.",커뮤니케이션의 문제 상황이 복잡한 경우 공식적인 수치와 공식적 서신이 소통방식으로 적합하다.,공식적인 서신과 공식적인 수치는 대면적 의사소통에 비하여 의미있는 정보를 전달할 잠재력이 높다.,제한된 합리성이론에 따르면 '의사결정자가 현 상태에 만족한다면 새로운 대안 모색에 나서지 않는다' 라고 한다.,5
산업안전지도사,2013,1,기업진단·지도,57,직무와 관련된 설명으로 옳은 것은?,,직무충실화는 허즈버그(F.Herzberg)가 2요인 이론을 직무에 구체적으로 적용하기 위하여 제창한 것이다.,"직무분석에는 서열법, 분류법, 점수법, 요소비교법 등의 방법들이 활용된다.","직무기술서에는 직무수행에 요구되는 기능, 지식, 육체적 능력과 교육수준이 기술되어 있다.",직무명세서에는 직무가치와 직무확대에 대한 구체적인 지침이 제시되어 있다.,"직무평가의 1차적 목적은 직무기술서나 직무명세서를 작성하는 것이며, 2차적으로는 조직, 인사관리를 위한 자료를 제공하는 것이다.",1
산업안전지도사,2013,1,기업진단·지도,58,BSC(Balanced Score Card)에 관한 설명으로 옳지 않은 것은?,,내부 프로세스 관점과 학습 및 성장 관점도 평가의 주요 관점이다.,재무적 관점 이외에 고객관점도 평가의 주요 관점이다.,로버트 카플란(R. Kaplan)과 노튼(D. Norton)이 제안한 성과 평가 방식이다.,"균형잡힌 성과 측정을 위한 것으로 대개 재무와 비재무지표, 결과와 과정, 내부와 외부, 노와 사 간의 균형을 추구하는 도구이다.",전략 모니터링 또는 전략 실행을 관리하기 위한 도구로 활용하는 경우에는 성과평가 결과를 보상에 연계시키지 않는 것이 바람직하다는 견해가 있다.,4
산업안전지도사,2013,1,기업진단·지도,59,막스 베버(M. Weber)가 제시한 관료제의 특징은?,,조직의 활동을 합리적으로 조정하기 위해서는 업무처리를 위한 절차가 명확하게 규정되어야 한다.,조직구성원 간 의사소통의 활성화를 위해 수평적 조직구조를 선호한다.,환경에 대한 적절한 대응을 위해 조직구성원 간의 정보공유를 중시한다.,'기계적 관료제'라 불리며 복잡한 환경의 대규모 조직에 효과적이다.,하급자는 상급자의 감독과 통제 하에 놓이게 되나 성과 평가를 할 때에는 하급자도 상급자의 평가과정에 참여한다.,1
산업안전지도사,2013,1,기업진단·지도,60,와르(Warr)의 정신 건강 구성요소에 대한 설명으로 옳지 않은 것은?,,정서적 행복감 : 쾌감과 각성이라는 두 가지 독립된 차원을 가지고 있다.,결단 : 환경적 영향력에 저항하고 자신의 의견이나 행동을 결정할 수 있는 개인의 능력을 의미한다.,역량 : 생활에서 당면하는 문제들을 효과적으로 다룰 수 있는 충분한 심리적 자원을 가지고 있는 정도를 의미한다.,"포부 : 포부수준이 높다는 것은 동기수준과 관계가 있으며, 새로운 기회를 적극적으로 탐색하고, 목표 달성을 위하여 도전하는 것을 의미한다.",통합된 기능 : 목표달성이 어려울 때 느끼는 긴장감과 그렇지 않을 때 느끼는 이완감 사이에 조화로운 균형을 유지할 수 있는 정도를 의미한다.,2
산업안전지도사,2013,1,기업진단·지도,61,직무분석에 대한 설명으로 옳지 않은 것은?,,특정직무에 대한 훈련 프로그램을 개발하기 위해서는 직무의 속성과 요구하는 기술을 알아야 한다.,효과적인 수행을 하기 위한 직무나 작업장을 설계하는데 도움을 준다.,작업시 시간과 노력의 낭비를 제거할 수 있고 안전 저해요소나 위험요소를 발견할 수 있다.,"특정직무에 대한 직무분석을 하는 기법으로 면접법, 질문지법, 관찰법, 행동기법, 중대사건기법, 투사기법 등이 있다.","과업수행에 사용되는 도구, 기구, 수행목적, 요구되는 교육훈련, 임금수준 및 안전저해요소 등에 대한 정보가 포함되어 있다.",4
