Test Name,Year,Session,Subject,Number,Question,Question_image,Option 1,Option 2,Option 3,Option 4,Option 5,Answer
산업안전지도사,2014,1,기업진단·지도,67,산업안전보건법령에 따른 물질안전보건자료(MSDS: material safety data sheet)의 작성에 관한 설명으로 옳지 않은 것은?,,다른 화학물질이 혼합되지 않은 원소·화합물의 화학물질에 대한 물질안전보건자료의 경우에는 그 구성성분의 함유량을 100%로 기재하여야 한다.,대상화학물질을 제조하거나 수입하려는 자는 물질안전보건자료를 고용노동부장관에게 제출해야 한다.,물질안전보건자료에 기재되어 있는 내용을 변경할 필요가 생긴 경우에는 이를 물질안전보건자료에 반영하여 대상화학물질을 양도받거나 제공받는 자에게 신속하게 제공하여야 한다.,화학물질 또는 화학물질을 함유한 제제는 이를 양도하거나 제공하는 자가 이를 양도받거나 제공받는 자에게 물질안전보건자료를 작성하여 제공하여야 한다.,"물질안전보건자료에는 화학제품과 회사에 관한 정보, 유해성·위험성, 폭발·화재시 대처방법, 누출사고시 대처방법, 취급 및 저장방법, 폐기시 주의사항 등이 기재되어야 한다.",2
산업안전지도사,2014,1,기업진단·지도,68,행동수정을 위해 사용되는 강화(reinforcement) 방법 중 변동간격법(variable interval schedules)에 관한 설명으로 옳은 것은?,,특정행동 수에 상관없이 일정시간이 지난 후 보상하는 방법이다.,보상사이의 시간간격에 변화를 주는 방법이다.,비율에 따라 보상하고 그 비율에 변화를 주는 방법이다.,일정량의 행동에 대하여 일정 비율로 보상하는 방법이다.,바람직한 행동에 대하여 상시적으로 보상하는 방법이다.,3
산업안전지도사,2014,1,기업진단·지도,69,국소배기장치에 대한 설명으로 옳지 않은 것은?,,슬롯형 후드에서 제어속도는 측면 개구부가 있는 슬롯형 후드의 경우 플렌지 유무에 관계없이 슬롯 개구면에서의 풍속으로 한다.,유해물질이 발생하는 곳에는 발생원에서 기류가 들어가는 후드를 가능한 한 가까이 두는 것이 효과적이다.,청정공기가 근로자의 호흡영역을 지나 유해물질 발생원 및 후드 쪽으로 흐르도록 설계하여야 한다.,"유해물질의 성질, 비중, 발산형태, 발산속도, 작업자세 및 이동범위 등 인자를 고려하여 유해물질을 효율적으로 제어할 수 있는 구조로 설치하여야 한다.",유해물질의 종류에 관계없이 동일한 국소배기장치를 설치한다.,3
산업안전지도사,2014,1,기업진단·지도,70,다음 표를 보고 노출기준 초과 여부를 평가한 것으로 옳은 것은?\n| 유해인자 | 측정농도 | 노출기준 |\n| 톨루엔 | 25 ppm | 50 ppm |\n| 초산에틸 | 300 ppm | 400 ppm |\n| 메틸에틸케톤 | 100 ppm | 200 ppm |\n| 사염화탄소 | 3 ppm | 5 ppm |,,노출기준을 초과하였다.,노출기준의 2배를 초과하였다.,노출기준 이내이다.,노출기준을 초과하지 않았으나 직업병 위험도가 높다.,노출지수가 1.75 이다.,1
산업안전지도사,2014,1,기업진단·지도,71,석면(asbestos)에 관한 설명으로 옳지 않은 것은?,,"석면은 청석면(crocidolite), 갈석면(amosite), 백석면(chrysotile) 등이 있으며, 크기가 길이 5μm 이상이고, 길이 대 너비의 비가 3:1 이상인 섬유상의 규산화합물질을 말한다.","석면에 노출되면 석면 분진이 호흡기를 통하여 체내에 흡수되어 석면폐증, 악성중피종, 폐암 등의 건강장해가 유발될 수 있다.",석면의 측정방법은 막여과지에 시료를 채취하여 투과전자현미경법으로 분석한다.,석면은 산업안전보건법에서 규정한 법정 특수건강진단대상 유해인자에 해당된다.,석면은 세계보건기구(WHO)의 국제암연구기관(IARC)에서 인체발암물질(group 1)로 분류되어 있다.,5
산업안전지도사,2014,1,기업진단·지도,72,개인보호구에 관한 설명으로 옳지 않은 것은?,,방진마스크는 베릴륨 등과 같이 독성이 강한 분진을 걸러내는데 사용될 수 있다.,방독마스크의 흡수관 내에 들어있는 활성탄은 산소결핍장소에서 사용할 수 없다.,"송기마스크, 자급식 호흡보호구 등의 공기공급식 마스크를 산소결핍장소에서 사용할 수 있다.","작업장에서 방독마스크, 방진마스크 등을 혼용하여 유해물질에 노출되는 것을 방지할 수 있다.",방독마스크는 공기 중 최소 산소농도가 18% 이상인 장소에서 사용해야 한다.,"1,4"
산업안전지도사,2014,1,기업진단·지도,73,공기오염물질의 시료채취방법에 관한 설명으로 옳지 않은 것은?,,고체포집법은 활성탄이나 실리카겔 등 흡착제에 가스상의 오염물질을 흡착시키는 시료채취방법이다.,액체포집법은 임핀저 등에 흡수액을 넣은 후 펌프로 공기를 통과시켜 오염물질을 용해시키는 시료채취방법이다.,여과지포집법은 필터에 입자상 오염물질을 포집시키는 시료채취방법이다.,직접포집법은 유기용제가 묻은 시료를 밀폐용기에 포집하여 밀봉하는 방법으로 휘발성 유기화합물을 채취할 때 사용하는 시료채취방법이다.,여과지포집법에는 셀룰로오스에스테르막여과지(MCE Filter)와 PVC여과지가 주로 쓰이고 있다.,"1,5"
산업안전지도사,2014,1,기업진단·지도,74,산업환기의 종류 및 방법에 관한 설명으로 옳은 것은?,,전체환기방식은 작업환경 내 유해물질의 농도가 거의 균일하게 분포된 경우에 적합하다.,"국소배기장치에서 오염된 공기가 배출되면, 배출된 공기의 양만큼 깨끗한 공기가 외부에서 유입되어야 하므로 배기량과 급기량의 차이를 크게 한다.",자연환기는 급기팬과 배기팬을 설치하는 방식이다.,전체환기방식은 발생원에서 오염물질이 배출되기 전에 공기유입 및 배기를 시키는 환기방법이다.,국소배기장치는 오염공기를 전체적으로 확산·희석시키는 방식이다.,2
산업안전지도사,2014,1,기업진단·지도,75,근로자를 야간작업에 종사시킬 때의 건강장해예방 조치사항에 관한 설명으로 옳지 않은 것은?,,야간작업을 포함한 교대작업에 근로자를 종사하도록 하는 경우에는 교대작업으로 인하여 근로자에게 건강장해가 발생하지 않도록 관리하여야 한다.,야간작업이란 오후 10시부터 다음날 오전 5시까지의 작업을 말한다.,야간작업이 포함된 교대작업은 가급적 순방향(아침→오후→밤→휴일)으로 순환되도록 조정하여야 한다.,야간작업 시 적정한 수면시설은 수면에 방해가 되지 않는 장소에 설치하여야 한다.,야간작업의 휴식시간 중에는 수면을 취하지 않도록 유도하는 등의 조치를 취하여야 한다.,1
