Test Name,Year,Session,Subject,Number,Question,Question_image,Option 1,Option 2,Option 3,Option 4,Option 5,Answer
산업안전지도사,2014,1,산업안전보건법령,1,"산업안전보건법령상 유해·위험한 작업의 도급에 대한 다음 내용에 관한 설명으로 옳지 않은 것은?\nA사는 정밀기계제조업을 영위하는 업체이다. B사는 A사의 공장 내에서 A사의 작업설비를 사용하여 업무를 수행하는 하도급업체이다. B사는 A사와 동일한 정밀기계제조업을 하고 있으며, 공정의 마무리 단계에서 정밀기계의 부식방지를 위한 도금작업이 포함되어 있다. B사는 도금업을 전문적으로 해 온 C사에게 도금작업 부분만을 하도급하고자 한다.",,"도금작업은 안전·보건상 유해하거나 위험한 작업에 해당하므로, 이를 분리하여 하도급을 주는 경우에는 인가를 받아야 한다.",B사는 C사에 대한 도급인가를 받기 위하여 관할 지방고용노동관서의 장에게 도급인가 신청서를 제출하여야 한다.,B사는 도급인가 신청서를 제출할 때 도금작업을 포함한 전체 작업의 공정도와 도급계획서를 첨부하여야 한다.,지방고용노동관서의 장은 도급인가 신청서가 접수된 날부터 10일 이내에 신청서를 반려하거나 인가증을 신청자에게 발급하여야 한다.,지방고용노동관서의 장은 도급인가를 신청한 사업장이 유해하거나 위험한 작업의 도급 시 지켜야 할 안전·보건조치의 기준을 지키고 있는지 확인할 필요가 있는 경우에는 한국산업안전보건공단으로 하여금 기술적 사항을 확인하게 할 수 있다.,3
산업안전지도사,2014,1,산업안전보건법령,2,산업안전보건법령상 도급사업 시의 안전보건조치에 관한 설명으로 옳지 않은 것은?,,제조업의 사업주가 사업의 일부를 도급한 경우 도급인인 사업주는 1주일에 1회 이상 작업장을 순회점검하여야 한다.,"건설업의 사업주가 안전·보건에 관한 협의체를 구성한 경우 그 협의체에 근로자위원으로서 도급 또는 하도급 사업을 포함한 전체 사업의 근로자대표, 명예산업안전감독관 및 근로자대표가 지명하는 해당 사업장의 근로자를 포함한 산업안전보건위원회를 구성할 수 있다.",안전·보건에 관한 협의체는 도급인인 사업주 및 그의 수급인인 사업주 전원으로 구성하여야 한다.,안전·보건에 관한 협의체는 매월 1회 이상 정기적으로 회의를 개최하고 그 결과를 기록·보존하여야 한다.,도급인인 사업주는 수급인인 사업주가 실시하는 근로자의 해당 안전·보건교육에 필요한 장소 및 자료의 제공 등 필요한 조치를 하여야 한다.,1
산업안전지도사,2014,1,산업안전보건법령,3,"산업안전보건법령상 사업주가 근로자에 대하여 실시하는 안전·보건교육의 교육대상, 교육과정 및 교육시간의 조합으로 옳은 것은?",,일용근로자를 제외한 근로자에 대한 작업내용변경 시의 교육 - 2시간 이상,밀폐공간에서의 작업에 종사하는 근로자에 대한 특별안전·보건교육 - 8시간 이상,건설 일용근로자에 대한 건설업 기초안전·보건교육 - 2시간,관리감독자의 지위에 있는 사람에 대한 정기교육 - 연간 12시간 이상,판매업무에 직접 종사하는 근로자에 대한 정기교육 - 매분기 2시간 이상,1
산업안전지도사,2014,1,산업안전보건법령,4,산업안전보건법령상 안전보건관리책임자 등에 대한 직무교육에 관한 설명으로 옳은 것은?,,보건관리자가 의사인 경우는 선임된 후 1년 이내에 직무를 수행하는 데 필요한 신규교육을 받아야 한다.,안전보건관리책임자로 선임된 자는 6개월 이내에 직무를 수행하는 데 필요한 신규교육을 받아야 한다.,안전관리자로 선임된 자는 신규교육을 이수한 후 매 2년이 되는 날을 기준으로 전후 6개월 사이에 고용노동부장관이 실시하는 안전·보건에 관한 보수교육을 받아야 한다.,기업활동 규제완화에 관한 특별조치법에 따라 안전관리자로 채용된 것으로 보는 사람은 신규교육이 면제된다.,직무교육기관의 장은 직무교육을 실시하기 10일 전까지 교육 일시 및 장소 등을 직무교육 대상자에게 알려야 한다.,1
산업안전지도사,2014,1,산업안전보건법령,5,산업안전보건법령상 방호조치에 대한 근로자의 준수사항 및 사업주의 조치사항으로 옳지 않은 것은?,,근로자는 방호조치를 해체하려는 경우에는 사업주의 허가를 받아 해체하여야 한다.,근로자는 방호조치를 해체한 후 그 사유가 소멸된 경우에는 지체 없이 원상으로 회복시켜야 한다.,근로자는 방호조치의 기능이 상실된 것을 발견한 경우에는 지체 없이 사업주에게 신고하여야 한다.,사업주는 방호조치가 정상적인 기능을 발휘할 수 있도록 상시 점검 및 정비를 하여야 한다.,"사업주는 방호조치의 기능상실 신고가 있으면 충분한 검토를 통해 적절한 조치계획을 수립한 후 수리, 보수하여야 한다.",5
산업안전지도사,2014,1,산업안전보건법령,6,산업안전보건법령상 안전인증에 관한 설명으로 옳지 않은 것은?,,안전인증을 받은 자는 안전인증을 받은 제품에 대하여 고용노동부령으로 정하는 바에 따라 제품명·모델·제조수량·판매수량 및 판매처 현황 등의 사항을 기록·보존하여야 한다.,안전인증이 취소된 자는 취소된 날부터 1년 이내에는 같은 규격과 형식의 유해·위험한 기계·기구·설비등에 대하여 안전인증을 신청할 수 없다.,고용노동부장관이 정하여 고시하는 안전인증기준에 맞지 아니하게 된 안전인증대상 기계·기구등을 사용한 자는 3년 이하의 징역 또는 2천만원 이하의 벌금에 처해지게 된다.,거짓이나 부정한 방법으로 안전인증을 받은 경우 3년 이내의 기간 동안 안전인증표시의 사용이 금지된다.,수출을 목적으로 제조하는 안전인증대상 기계·기구등은 안전인증이 전부 면제된다.,4
산업안전지도사,2014,1,산업안전보건법령,7,산업안전보건법령상 자율안전확인대상 기계·기구만으로 짝지어진 것은?,,휴대형 연삭기 - 동력식 수동대패용 칼날 접촉 방지장치 - 안전화,파쇄기 - 롤러기 급정지장치 - 보안면(용접용 보안면 제외),산업용 로봇 - 양중기용 과부하방지장치 - 잠수기,사출성형기 - 산업용 로봇 안전매트 - 방진마스크,전단기 및 절곡기 - 교류 아크용접기용 자동전격방지기 - 보안경,"1,2,3,4,5"
산업안전지도사,2014,1,산업안전보건법령,8,산업안전보건법령상 안전검사에 관한 설명으로 옳은 것은?,,유해·위험기계등이 고용노동부령이 정하는 다른 법령에 따라 안전성에 관한 검사나 인증을 받은 경우라 하더라도 안전검사를 실시하여야 한다.,건설현장에서 사용하는 크레인은 최초로 설치한 날부터 1년마다 안전검사를 받아야 한다.,고용노동부장관은 안전검사 업무를 위탁받아 수행할 기관을 지정할 수 있다.,공정안전보고서를 제출하여 확인을 받은 압력용기는 3년마다 안전검사를 받아야 한다.,안전검사에 합격한 유해·위험기계등을 사용하는 사업주는 그 유해·위험기계등이 안전검사에 합격한 것임을 나타내는 표시를 하지 않아도 된다.,3
산업안전지도사,2014,1,산업안전보건법령,9,산업안전보건법령상 건축물이나 설비를 철거하거나 해체하는 경우 기관석면조사를 실시하여야 할 대상으로 옳은 것은?,,"주택의 연면적 합계가 200 m²이상이면서, 그 주택의 철거·해체하려는 부분의 면적 합계가 150 m²이상인 경우","건축물(주택 제외)의 연면적 합계가 50 m²이상이면서, 그 건축물의 철거·해체하려는 부분의 면적 합계가 50 m²이상인 경우",철거·해체하려는 부분에 실링(sealing)재를 사용한 부피의 합이 0.5 m³이상인 경우,철거·해체하려는 부분에 단열재를 사용한 면적의 합이 10 m²이상인 경우,"파이프 길이의 합이 80 m 이상이면서, 그 파이프의 철거·해체하려는 부분의 보온재로 사용된 길이의 합이 60 m 이상인 경우",2
산업안전지도사,2014,1,산업안전보건법령,10,산업안전보건기준에 관한 규칙상 사업주가 급성 독성물질의 누출로 인한 위험을 방지하기 위하여 취할 조치가 아닌 것은?,,사업장 내 급성 독성물질의 저장 및 취급량을 최소화할 것,급성 독성물질을 취급 저장하는 설비의 연결 부분은 누출되지 않도록 밀착시키고 매월 1회 이상 연결부분에 이상이 있는지를 점검할 것,급성 독성물질을 폐기·처리하여야 하는 경우에는 냉각·분리·흡수·흡착·소각 등의 처리공정을 통하여 급성 독성물질이 외부로 방출되지 않도록 할 것,급성 독성물질이 외부로 누출된 경우에는 감지·경보할 수 있는 설비를 갖출 것,급성 독성물질을 폐기·처리 또는 방출하는 설비를 설치하는 경우에는 수동으로 작동될 수 있는 구조로 하거나 원격조정할 수 있는 조작구조로 설치할 것,5
산업안전지도사,2014,1,산업안전보건법령,11,"산업안전보건법령상 작업과 휴식의 적정한 배분, 그 밖에 근로시간과 관련된 근로조건의 개선을 통하여 근로자의 건강보호를 위한 조치를 하여야 하는 유해·위험작업을 모두 고른 것은?\nㄱ. 갱(坑) 내에서 하는 작업\nㄴ. 다량의 저온물체를 취급하는 작업과 현저히 춥고 차가운 장소에서 하는 작업\nㄷ. 강렬한 소음이 발생하는 장소에서 하는 작업\nㄹ. 인력으로 중량물을 취급하는 작업",,"ㄴ, ㄹ","ㄱ, ㄴ, ㄷ","ㄱ, ㄷ, ㄹ","ㄴ, ㄷ, ㄹ","ㄱ, ㄴ, ㄷ, ㄹ",5
산업안전지도사,2014,1,산업안전보건법령,12,"산업안전보건법령상 다음 ( ) 안에 들어갈 숫자를 순서대로 배열한 것은?\n사업주는 최근 1년간 작업공정에서 공정 설비의 변경, 작업방법의 변경, 설비의 이전, 사용 화학물질의 변경 등으로 작업환경측정 결과에 영향을 주는 변화가 없는 경우로서 다음 각 호의 어느 하나에 해당하는 경우에는 해당 유해인자에 대한 작업환경측정을 1년에 1회 이상 할 수 있다. 다만, 고용노동부장관이 정하여 고시하는 물질을 취급하는 작업공정은 그러하지 아니하다.\n1. 작업공정 내 소음의 작업환경측정 결과가 최근 ( )회 연속 ( ) dB 미만인 경우\n2. 작업공정 내 소음 외의 다른 모든 인자의 작업환경측정 결과가 최근 ( )회 연속 노출기준 미만인 경우",,"2, 75, 2","2, 80, 3","2, 85, 2","3, 80, 3","3, 85, 2",3
산업안전지도사,2014,1,산업안전보건법령,13,산업안전보건법령상 건강진단에 관한 설명으로 옳지 않은 것은?,,근로자대표가 요구할 때에는 건강진단 시 근로자대표를 입회시켜야 한다.,고용노동부장관은 근로자의 건강을 보호하기 위하여 필요하다고 인정할 때에는 사업주에게 특정 근로자에 대한 임시건강진단의 실시나 그 밖에 필요한 조치를 명할 수 있다.,배치전건강진단이란 특수건강진단대상업무에 종사할 근로자에 대하여 배치 예정 업무에 대한 적합성 평가를 위하여 사업주가 실시하는 건강진단을 말한다.,건강진단기관은 건강진단을 실시한 결과 질병 유소견자가 발견된 경우에는 건강진단을 실시한 날부터 60일 이내에 관할 지방고용노동관서의 장에게 보고하여야 한다.,사업주는 건강진단 결과를 근로자의 건강 보호·유지 외의 목적으로 사용하여서는 아니 된다.,4
산업안전지도사,2014,1,산업안전보건법령,14,산업안전보건법령상 근로자대표가 사업주에게 그 내용 또는 결과를 통지할 것을 요청할 수 있는 사항이 아닌 것은?,,산업재해 예방계획의 수립에 관하여 산업안전보건위원회가 의결한 사항,개별 근로자의 건강진단 결과에 관한 사항,작업환경측정에 관한 사항,안전보건개선계획의 수립·시행명령을 받은 사업장의 경우 안전보건개선계획의 수립·시행 내용에 관한 사항,물질안전보건자료의 작성·비치 등에 관한 사항,2
산업안전지도사,2014,1,산업안전보건법령,15,산업안전보건기준에 관한 규칙상 석면해체·제거작업 및 유지·관리 등의 조치기준으로 옳지 않은 것은?,,사업주는 석면해체·제거작업에 근로자를 종사하도록 하는 경우에는 1급 방진마스크를 지급하여 착용하도록 하여야 한다.,"사업주는 분말 상태의 석면을 혼합하거나 용기에 넣거나 꺼내는 작업, 절단·천공 또는 연마하는 작업 등 석면분진이 흩날리는 작업에 근로자를 종사하도록 하는 경우에 석면의 부스러기 등을 넣어두기 위하여 해당 장소에 뚜껑이 있는 용기를 갖추어 두어야 한다.",사업주는 석면 취급작업을 마친 근로자의 오염된 작업복은 석면 전용의 탈의실에서만 벗도록 하여야 한다.,사업주는 석면해체·제거작업장과 연결되거나 인접한 장소에 탈의실·샤워실 및 작업복 갱의실 등의 위생설비를 설치하고 필요한 용품 및 용구를 갖추어 두어야 한다.,사업주는 석면해체·제거작업에서 발생된 석면을 함유한 잔재물은 습식으로 청소하거나 고성능필터가 장착된 진공청소기를 사용하여 청소하는 등 석면분진이 흩날리지 않도록 하여야 한다.,1
산업안전지도사,2014,1,산업안전보건법령,16,"산업안전보건법령상 다음 내용에서 옳은 것을 모두 고른 것은?\nㄱ. 건강진단 실시에 있어서 사무직에 종사하는 근로자란 공장 또는 공사현장과 같은 구역에 있지 아니한 사무실에서 서무·인사·경리·판매·설계 등의 사무업무에 종사하는 근로자를 말하며, 판매업무 등에 직접 종사하는 근로자는 제외한다.\nㄴ. 특수건강진단을 실시한 결과 직업병 유소견자가 발견된 작업공정에서 해당 유해인자에 노출되는 모든 근로자에 대하여 다음 회에 한정하여 관련 유해인자별로 특수건강진단 주기를 2분의 1로 단축하여야 한다.\nㄷ. 특수건강진단기관은 근로자에 대해 특수건강진단을 실시한 날부터 30일 이내에 건강진단 결과표를 지방고용노동관서의 장에게 제출하여야 한다.\nㄹ. 선원법에 따른 건강진단을 받은 근로자는 일반건강진단을 실시한 것으로 본다.",,"ㄷ, ㄹ","ㄱ, ㄴ, ㄷ","ㄱ, ㄷ, ㄹ","ㄴ, ㄷ, ㄹ","ㄱ, ㄴ, ㄷ, ㄹ",5
산업안전지도사,2014,1,산업안전보건법령,17,산업안전보건법령상 안전·보건표지 중 안내표지에 해당하는 것은?,O,세안장치,방진마스크 착용,금연,석면취급/해체 작업장\n관계자외 출입금지\n석면 취급/해체 중\n보호구/보호복 착용\n흡연 및 음식물 섭취 금지,고압전기 경고,1
산업안전지도사,2014,1,산업안전보건법령,18,산업안전보건법령상 사업주의 의무에 관한 설명으로 옳은 것은?,,사업주는 근로자가 산업안전보건법령의 요지를 알 수 있도록 서면으로 교부하여야 한다.,외국인근로자를 채용한 사업주는 해당 근로자의 모국어로 된 안전·보건표지와 작업안전수칙을 부착하여야 한다.,사업주는 연속적으로 컴퓨터 단말기 작업에 종사하는 근로자에 대하여 작업시간 중에 적절한 휴식시간을 부여하여야 한다.,사업주는 작업환경측정 결과를 기록한 서류를 3년간 보존하여야 한다.,사업주는 안전·보건표지의 성질상 설치나 부착이 곤란한 경우에는 해당 물체에 직접 도장하여야 한다.,3
산업안전지도사,2014,1,산업안전보건법령,19,산업안전보건법령상 사업장의 관리감독자가 수행하여야 하는 업무에 해당하는 것은?,,근로자의 안전·보건교육에 관한 사항,위험성평가를 위한 업무에 기인하는 유해·위험요인의 파악 및 그 결과에 따른 개선조치의 시행에 관한 사항,안전·보건과 관련된 안전장치 및 보호구 구입 시의 적격품 여부 확인에 관한 사항,작업환경측정 등 작업환경의 점검 및 개선에 관한 사항,산업재해에 관한 통계의 기록 및 유지에 관한 사항,2
산업안전지도사,2014,1,산업안전보건법령,20,산업안전보건법령상 안전관리자에 관한 설명으로 옳은 것은?,,같은 사업주가 경영하는 둘 이상의 사업장이 같은 시·군·자치구 지역에 소재하는 경우에도 사업장마다 각각 안전관리자를 두어야 한다.,건설업의 경우 공사금액 120억원(토목공사업에 속하는 공사는 150억원) 이상인 사업장에는 해당 사업장에서 안전관리자의 업무만을 전담하는 안전관리자를 두어야 한다.,지방고용노동관서의 장은 중대재해가 연간 2건 발생한 경우 사업주에게 안전관리자를 정수 이상으로 증원할 것을 명할 수 있다.,상시 근로자 300명 미만을 사용하는 건설업은 안전관리자의 업무를 안전관리전문기관에 위탁할 수 있다.,사업주는 안전관리자를 선임한 경우 선임한 날부터 30일 이내에 고용노동부장관에게 증명할 수 있는 서류를 제출하여야 한다.,2
산업안전지도사,2014,1,산업안전보건법령,21,산업안전보건법령상 산업안전보건위원회를 설치·운영하여야 하는 사업이 아닌 것은?,,상시 근로자 50명인 토사석 광업,상시 근로자 100명인 비금속 광물제품 제조업,상시 근로자 50명인 전투용 차량 제조업,상시 근로자 100명인 사무용 기계 및 장비 제조업,상시 근로자 50명인 자동차 및 트레일러 제조업,3
산업안전지도사,2014,1,산업안전보건법령,22,산업안전보건법령상 안전보건관리규정에 관한 설명으로 옳은 것은?,,안전보건관리규정을 작성하여야 할 경우 소방·가스·전기·교통 분야 등의 다른 법령에서 정하는 안전관리에 관한 규정과 별도로 작성하여야 한다.,안전보건관리규정은 해당 사업장에 적용되는 단체협약 및 취업규칙에 우선한다.,사업주는 안전보건관리규정을 작성하여야 할 사유가 발생한 날부터 60일 이내에 안전보건관리규정을 작성하여야 한다.,사업주가 안전보건관리규정을 변경할 때에 산업안전보건위원회가 설치되어 있지 아니한 사업장의 경우에는 근로자대표에게 통보하면 된다.,안전보건관리규정에는 사고 조사 및 대책 수립에 관한 사항이 포함되어야 한다.,5
산업안전지도사,2014,1,산업안전보건법령,23,산업안전보건법령에 따라 안전·보건진단을 받아 안전보건개선계획을 수립·제출하도록 명할 수 있는 사업장에 해당하는 것은?,,산업재해율이 같은 업종 평균 산업재해율의 1.5배인 사업장,산업재해율이 같은 업종의 규모별 평균 산업재해율보다 높은 사업장으로서 부상자가 동시에 5명 발생한 사업장,2개월의 요양이 필요한 부상자가 동시에 2명 발생한 사업장,"상시 근로자가 1,200명으로서 직업병에 걸린 사람이 연간 2명 발생한 사업장",작업환경 불량 등으로 사회적 물의를 일으킨 사업장,5
산업안전지도사,2014,1,산업안전보건법령,24,산업안전보건법령상 산업안전지도사 또는 산업보건지도사의 등록을 취소하여야 하는 사유를 모두 고른 것은?\nㄱ. 직무의 수행과정에서 고의로 인하여 중대재해가 발생한 경우\nㄴ. 업무정지 기간 중에 업무를 수행한 경우\nㄷ. 다른 사람에게 자기의 성명을 사용하여 지도사의 직무를 수행하게 한 경우\nㄹ. 거짓이나 그 밖의 부정한 방법으로 등록한 경우\nㅁ. 업무 관련 서류를 거짓으로 작성한 경우\nㅂ. 금고 이상의 형의 집행유예를 선고받고 그 유예기간 중에 있는 경우,,"ㄱ, ㄷ, ㄹ","ㄱ, ㄹ, ㅂ","ㄴ, ㄷ, ㅁ","ㄴ, ㄹ, ㅂ","ㄷ, ㅁ, ㅂ",4
산업안전지도사,2014,1,산업안전보건법령,25,산업안전보건법령에서 규정하고 있는 명예산업안전감독관의 업무가 아닌 것은?,,사업장에서 하는 자체점검 참여 및 근로감독관이 하는 사업장 감독 참여,법령을 위반한 사실이 있는 경우 사업주에 대한 개선 요청 및 감독기관에의 신고,산업재해 발생의 급박한 위험이 있는 경우 사업주에 대한 작업중지 요청,사업장 순회점검·지도 및 조치의 건의,직업성 질환의 증상이 있거나 질병에 걸린 근로자가 여럿 발생한 경우 사업주에 대한 임시건강진단 실시 요청,4
산업안전지도사,2014,1,산업안전일반,26,안전교육에 관한 설명으로 옳지 않은 것은?,,안전교육은 안전사고를 사전에 방지하기 위한 필수요소 중의 하나이다.,"안전교육의 3요소는 강사, 수강자, 교재이다.",단계별 안전교육은 '지식교육 - 기능교육 - 태도교육' 순이다.,강의식 교육은 많은 인원의 수강자를 동시에 교육시킬 수 있는 장점이 있다.,하버드학파의 5단계 교수법은 preparation(준비) - presentation(발표) - generalization(보편화) - association(조합) - application(응용)의 순서로 한다.,5
산업안전지도사,2014,1,산업안전일반,27,"산업안전보건법령상 규정하고 있는 유해·위험방지계획서에 관한 설명 중 ㄱ, ㄴ의 내용이 옳게 연결된 것은?\n건설업 중 터널건설 등의 공사를 착공하려는 사업주는 관련 절차를 준수하여 작성한 유해·위험방지계획서에 해당 서류를 첨부하여 해당 공사의 착공 ( ㄱ )까지 ( ㄴ )에 제출하여야 한다.",,"ㄱ : 전날, ㄴ : 한국산업안전보건공단","ㄱ : 전날, ㄴ : 관할 지방고용노동관서","ㄱ : 3일전, ㄴ : 한국산업안전보건공단","ㄱ : 3일전, ㄴ : 관할 지방고용노동관서","ㄱ : 7일전, ㄴ : 한국산업안전보건공단",1
산업안전지도사,2014,1,산업안전일반,28,인간공학적 설계를 위하여 고려하여야 하는 작업환경 영향요소의 설명으로 옳지 않은 것은?,,조명은 작업대의 조도기준 상 보통작업은 150 럭스 이상으로 한다.,"온도는 작업의 경중에 따라 그 기준치를 달리하며, 일반적으로 최적온도는 18~21℃이다.","우리나라의 소음 노출기준은 90 dB(A) 에 8 시간 노출을 기준으로 정하고 있으며, '5 dB(A) 법칙'을 적용하지 않는다.","고열, 냉습, 온도, 기류 및 환기가 적절하지 않은 경우 작업자의 건강과 정신적 스트레스 및 육체적 피로에 영향을 미친다.","표시·조종장치는 작업정보가 정확하게 표시되고, 인간의 실수 또는 오조종으로 위험이 발생하지 않도록 보호장치 및 비상조종장치를 설치한다.",3
산업안전지도사,2014,1,산업안전일반,29,시스템에 관한 설명으로 옳지 않은 것은?,,시스템의 정의는 '다수의 독립된 목적 또는 개념적 요소의 집합체가 어떤 공동의 목적을 달성하도록 상호 유기적으로 결합해 활동하도록 된 것'이다.,"시스템은 여러 요소의 집합체로서 각 요소는 같은 기능을 수행하면서 상호 유기적인 관계를 유지하고, 공동의 목표를 지향하며 활동하는 것이다.",요소의 결합이 자연적으로 된 것을 '생태시스템'이라 한다.,"공학시스템에는 수송 시스템, 송배전 시스템, 생산 시스템 등이 있다.","공학시스템에서의 수송 시스템은 버스 시스템, 기차 시스템, 항공기 시스템 등으로 구성된다.",2
산업안전지도사,2014,1,산업안전일반,30,안전 용어에 관한 설명으로 옳지 않은 것은?,,"재해는 시스템의 전부 또는 일부의 손실, 작업자의 상해, 관련설비 또는 하드웨어의 재산적 피해와 무상해, 무손실 사고를 모두 포함한다.","안전은 사망, 부상, 직업성 질병, 장비 또는 재산의 파손이나 유실, 환경의 파손 등을 가져올 수 있는 조건으로부터 벗어난 상태이다.","시스템안전공학은 시스템의 위험요소를 확인하고, 이를 제거하기 위해 관련 지식, 기술 및 기능을 이용하여 과학적 및 기술적 기준을 기업 등에 적용하기 위한 시스템공학의 한 분야이다.",리스크는 사고발생의 가능성 또는 불확실성이라는 의미로도 사용할 수 있다.,J. Stephenson(스테픈슨)은 리스크를 위험의 심각도와 확률을 모두 고려해 평가되는 위험의 크기라고 정의하였다.,1
