Test Name,Year,Session,Subject,Number,Question,Question_image,Option 1,Option 2,Option 3,Option 4,Option 5,Answer
산업안전지도사,2014,1,산업안전일반,31,제조물책임법에 관한 설명으로 옳은 것은?,,제조물 결함은 소비자가 입증해야 한다.,"제조물에는 배, 무 같은 농작물도 포함된다.","제조물 책임은 제조업자와 제조물을 공급한 자, 소비자가 공동으로 져야 한다.",제조자가 경고의 의무를 소홀히 한 경우라도 소비자의 과실로 인한 손실은 소비자가 책임을 져야한다.,제조업자가 해당 제조물을 공급한 때의 과학·기술수준으로는 결함의 존재를 발견할 수 없었다는 사실을 입증하면 책임은 면제된다.,5
산업안전지도사,2014,1,산업안전일반,32,"S기업의 상시근로자수는 100명이며, 연간 300일 근무 중 사망 재해건수 2건, 휴업일수 27일, 잔업시간 10,000시간, 조퇴시간으로 인한 손실시간이 500시간이 발생하였다. 이 기업의 재해통계로 옳은 것은? (단, 근로자의 1일 평균 근로시간은 8시간 30분이다.)",,도수율은 290 이다.,연천인율은 18.75 이다.,강도율은 56.79 이다.,평균강도율은 0.196 이다.,종합재해지수는 128.33 이다.,3
산업안전지도사,2014,1,산업안전일반,33,안전보건경영시스템에서 안전보건활동추진계획을 수립함에 있어 옳지 않은 것은?,,"사업장은 안전보건상의 목표를 달성하기 위한 활동 추진계획을 해당 업무별, 단위별(팀별, 부·과별)로 수립해야 한다.",안전보건활동추진계획의 문서화 여부는 사업주가 결정한다.,조직의 전체 목표 및 부서별 세부목표와 이를 추진하고자 하는 책임자를 지정해야 한다.,목표달성을 위한 안전보건활동계획의 수단·방법·일정을 결정해야 한다.,"안전보건활동추진계획은 정기적으로 검토되고, 조직의 운영변경 또는 새로운 계획의 추가사유가 발생할 때에는 수정하여야 한다.",2
산업안전지도사,2014,1,산업안전일반,34,고용노동부고시 사업장 위험성평가에 관한 지침의 내용으로 옳지 않은 것은?,,안전보건관리책임자 등 해당 사업장에서 사업의 실시를 총괄 관리하는 사람에게 위험성평가의 실시를 총괄 관리하게 한다.,사업주는 안전보건정보를 사전에 조사하여 위험성평가에 활용하여야 한다.,"유해위험요인을 파악할 때 업종, 규모 등 사업장 실정에 따라 청취조사에 의한 방법 등을 사용하여야 한다.","해당 작업에 종사하고 있는 근로자에게 유해·위험요인의 파악, 위험성의 추정, 위험성의 결정, 위험성 감소대책 수립 및 실행을 하게 한다.",허용가능한 위험성이 아니라고 판단되는 경우 위험성의 크기 등을 고려하여 감소대책을 수립하고 실행하여야 한다.,4
산업안전지도사,2014,1,산업안전일반,35,애드워드 아담스(Edward Adams)의 사고연쇄반응 이론을 설명한 것으로 옳은 것은?,,"연쇄이론은 기본 에러, 관리부족, 전술적 에러, 사고, 상해의 순으로 진행된다.",작전적 에러는 관리자의 의사결정이 그릇되거나 잘못된 행동으로 인한 것이다.,기본 에러는 불안전한 행동 및 불안전한 상태를 말한다.,사고의 바로 직전에는 관리구조의 부재가 존재한다.,사고와 상해는 필연적 관계로 존재한다.,2
산업안전지도사,2014,1,산업안전일반,36,"신뢰도함수는 평균 고장률이 0.01/시간인 지수분포에 따르고, 보전도함수는 평균수리율이 0.1/시간인 지수분포에 따르는 기계가 있다. 이 기계의 가용도(availability)는 얼마인가? (단, 소숫점 아래 셋째자리에서 반올림한다.)",,0.91,0.95,0.96,0.98,0.99,1
산업안전지도사,2014,1,산업안전일반,37,시스템의 설계 단계 중 '인터페이스 설계' 에 해당하는 것은?,,시스템의 목표와 성능에 대해 결정된 요구사항의 규격에 맞추어 시스템이 실행해야 할 기능을 정의하는 단계이다.,"시스템이 형태를 갖추기 시작하는 단계로서 주요 인간공학적 활동은 기능할당, 직무분석, 작업설계가 있다.",인간-기계 시스템의 계면의 특성에 초점을 두고 인간의 능력과 한계에 부합되도록 고려한다.,수용 가능한 인간성능을 도울 수 있는 자료 또는 보조물들에 대한 계획을 하게 된다.,개발절차가 진행됨에 따라 각 단계에 따르는 평가가 수행된다.,3
산업안전지도사,2014,1,산업안전일반,38,안전교육방법에 관한 설명으로 옳지 않은 것은?,,시범법은 어떤 기능이나 작업과정을 학습시키기 위해 필요로 하는 분명한 동작을 제시하는 교육방법이다.,토의법은 쌍방적 의사전달 방식에 의한 교육으로 적극성·지도성·협동성을 기르는 데 유효하다.,강의법은 많은 인원의 수강자를 단기간의 교육시간에 비교적 많은 교육 내용을 전수하기 위한 방법이다.,"사례연구법은 먼저 사례를 제시하고 문제가 되는 사실들과 그의 상호관계에 대해서 검토하며, 대책을 토의하는 방식이다.",반복법은 학습자가 이미 학습된 지식이나 기능을 교사의 지휘나 감독 아래 직접 연습하는 교육방법이다.,5
산업안전지도사,2014,1,산업안전일반,39,"FTA의 실시 과정에서 minimal cut set을 3개 구하였다. top 사건이 일어날 확률은 얼마인가? (단, 각 부품의 고장날 확률은 0.1 이고, minimal cut set은 {1, 4}, {1, 3, 5}, {2, 5} 이다.)",,0.01879,0.01969,0.02063,0.02071,0.02137,4
산업안전지도사,2014,1,산업안전일반,40,"청각적 표시장치가 시각적 표시장치보다 유리한 경우를 모두 고른 것은?\nㄱ. 화재 발생 등의 정보를 긴급히 알리고자 하는 경우\nㄴ. 움직이면서 작업하는 근로자에게 정보를 전달하는 경우\nㄷ. 주위가 밝은 장소에서 작업자에게 필요한 정보를 전달하고자 하는 경우\nㄹ. 많고, 다양한 정보를 한 번에 작업자에게 전달하는 경우",,"ㄱ, ㄴ","ㄱ, ㄷ","ㄱ, ㄴ, ㄷ","ㄱ, ㄷ, ㄹ","ㄱ, ㄴ, ㄷ, ㄹ",1
산업안전지도사,2014,1,산업안전일반,41,"인간공학에 대한 설명 중 옳은 것을 모두 고른 것은?\nㄱ. 일반적으로 공학이 기술·기능적 교육에 중점을 두고 있다면 인간공학은 시스템의 설계에 있어 인간요소를 고려한다.\nㄴ. 인간공학의 목표는 기능적 효과와 효율, 인간가치를 향상시키는 것이다.\nㄷ. 인간공학의 접근방법은 제품, 기구, 환경을 설계하는 과정에서 인간의 능력·한계, 특성, 행동에 관한 정보 등을 시스템 설계에 체계적으로 적용하는 것이다.\nㄹ. 적절한 선발과정과 훈련을 통해 사람을 작업에 맞추는 개념에서 시스템을 인간에게 적합하게 설계하는 개념으로 발전하였다.",,"ㄱ, ㄴ","ㄱ, ㄷ","ㄱ, ㄴ, ㄹ","ㄱ, ㄷ, ㄹ","ㄱ, ㄴ, ㄷ, ㄹ",5
산업안전지도사,2014,1,산업안전일반,42,안전보건교육에 관한 설명으로 옳지 않은 것은?,,"지식교육의 내용은 안전의식의 향상, 안전책임감 주입, 기초지식 주입, 전문적 기술기능 등이다.","안전교육에는 사고 사례 중심의 안전교육, 표준안전작업을 위한 안전교육 등이 있다.","안전보건교육계획을 수립할 때에는 필요한 정보의 수집, 현장 의견의 반영, 법규정에 의한 교육 등을 고려하여야 한다.","안전보건교육계획에 포함해야 할 사항은 교육목표, 교육의 종류 및 교육대상 등이 있다.","교육실시 계획에 포함해야 할 사항은 교육대상자의 범위 결정, 교육과정의 결정, 교육방법 및 형태의 결정 등이 있다.",1
산업안전지도사,2014,1,산업안전일반,43,"㉮ ~ ㉱에 해당하는 용어가 올바르게 짝지어진 것은?\n㉮ : 허용범위를 벗어난 일련의 인간 동작 중 하나\n㉯ : 계획된 목적 수행에 필요한 행동의 실행에 오류가 발생하는 것\n㉰ : 부적정한 계획 결과로 인해 원래의 목적수행에 실패하는 것\n㉱ : 작업자가 절차서의 지시를 고의로 따르지 않고, 다른 방향을 선택한 경우",,"㉮: 위반(violation), ㉯: 실패(mistake), ㉰: 가벼운 실수(slips), ㉱: 휴먼 에러(human error)","㉮: 실패(mistake), ㉯: 가벼운 실수(slips), ㉰: 휴먼 에러(human error), ㉱: 위반(violation)","㉮: 휴먼 에러(human error), ㉯: 위반(violation), ㉰: 가벼운 실수(slips), ㉱: 실패(mistake)","㉮: 실패(mistake), ㉯: 위반(violation), ㉰: 가벼운 실수(slips), ㉱: 휴먼 에러(human error)","㉮: 휴먼 에러(human error), ㉯: 가벼운 실수(slips), ㉰: 실패(mistake), ㉱: 위반(violation)",5
산업안전지도사,2014,1,산업안전일반,44,"시스템 1, 2에 관한 설명으로 옳은 것은? (단, 화살표는 부품의 경로이며, 각 부품의 신뢰도는 0.9로 동일하다.)",O,minimal path의 수는 두 시스템 모두 4개이다.,3번 부품의 신뢰도가 1 이라면 두 시스템의 신뢰도는 같다.,시스템 2 의 신뢰도가 시스템 1 보다 더 작다.,시스템 2 의 신뢰도는 0.99 보다 작다.,시스템 1 의 신뢰도는 '0.9 × (3번이 고장난 시스템의 신뢰도) + 0.1 × (시스템 2 의 신뢰도)' 이다.,4
산업안전지도사,2014,1,산업안전일반,45,학습지도의 원리를 설명한 것으로 옳지 않은 것은?,,학습자가 스스로 학습에 참여하는 것이 '자기활동의 원리'이다.,학습자의 요구와 능력에 적합한 학습활동의 기회를 제공하는 '개별화의 원리'가 있다.,현실사회의 문제와 사상을 기반으로 한 학습내용을 공동 학습으로 하는 '사회화의 원리'가 있다.,전문적인 지적·정의적·기능적 분야를 기술적으로 지도하는 '전문화의 원리'가 있다.,어떤 사물의 개념을 설명함에 있어 구체적인 사물을 직접 제시·경험시키는 '직관의 원리'가 있다.,4
산업안전지도사,2014,1,산업안전일반,46,"다음은 유해요인평가에서 근골격계 부담작업을 평가하는 기법들에 대한 설명이다. 옳은 것을 모두 고른 것은?\nㄱ. OWAS 기법은 몸통(허리), 팔, 다리, 무게, 목의 자세에 대하여 평가한다.\nㄴ. RULA 기법은 몸통(허리), 상완(윗팔), 전완(아래팔), 손목, 손목비틀림, 목, 다리의 자세에 대하여 평가하며, 근육사용 및 힘을 고려한다.\nㄷ. REBA 기법은 몸통(허리), 상완(윗팔), 전완(아래팔), 손목, 목, 다리의 자세에 대하여 평가하며, 힘 및 발의 사용을 고려한다.",,ㄱ,"ㄱ, ㄴ","ㄱ, ㄷ","ㄴ, ㄷ","ㄱ, ㄴ, ㄷ",2
산업안전지도사,2014,1,산업안전일반,47,재해조사에 관한 설명으로 옳지 않는 것은?,,재해조사는 5W1H 의 원칙에 입각하여 실시한다.,FTA 나 ETA 기법 등으로 재해분석을 할 수도 있다.,재해조사의 근본적인 취지는 재해 발생 책임자의 규명과 적절한 처벌을 하기 위함이다.,재해조사시 기본 원인을 4M 에서 파악한다.,재해조사는 '사실의 확인 - 직접원인과 문제점 확인 - 기본원인과 근본적 문제결정 - 대책수립' 순으로 한다.,3
산업안전지도사,2014,1,산업안전일반,48,위험성 평가기법에 관한 설명으로 옳은 것은?,,"FMEA는 정성적, 연역적 평가기법으로 시스템 요소의 고장을 형태별로 분석하는 기법이다.",HAZOP 기법은 가이드워드(guide word)와 공정의 파라메터(parameter)를 결합하여 위험요소와 운전상의 문제점을 도출한다.,ETA는 에너지의 흐름이 사람이나 설비에 도달하여 재해가 발생되지 않도록 장벽을 도입하는 기법이다.,FTA 는 기본 사상에서 top 사상으로 진행되어 간다.,"Decision Tree 기법은 연역적이고, 정량적인 분석 기법이다.",2
산업안전지도사,2014,1,산업안전일반,49,사고조사 원인분석 방법 가운데 통계적 재해원인 분석방법의 하나인 '클로즈(close) 분석도'에 해당하는 것은?,,사고의 유형이나 기인물 등의 분류 항목이 큰 것부터 작은 순서대로 도표화한 것이다.,특성과 그 요인의 관계를 도표화하여 분석하는 방법이다.,재해발생 추이를 파악하여 목표관리를 행하는데 관리선을 설정하여 분석한다.,"2개 이상의 문제관계를 분석하는데 이용되며, 요인별 결과내역을 교차한 그림을 사용하여 분석한다.",관리선은 상·하방관리한계 및 중심선(CL)으로 표시한다.,4
산업안전지도사,2014,1,산업안전일반,50,"안전조직의 형태는 라인, 스탭, 라인스탭으로 크게 분류된다. 각 조직에 대한 설명으로 옳은 것은?",,스탭 조직에서 생산부문은 안전에 대한 책임과 권한이 약하다.,라인 조직은 대기업에서 많이 사용된다.,라인스탭 조직에서는 안전활동이 생산과 유리될 우려가 크다.,라인 조직은 안전과 생산을 별개로 취급하기 쉽다.,라인 조직은 외부의 전문적 안전정보가 빠르게 습득된다.,1
산업안전지도사,2014,1,기업진단·지도,51,관찰 및 측정이 가능하고 직무와 관련된 피평가자의 행동을 평가기준으로 하는 행동기준고과법(BARS: behaviorally anchored rating scales)의 개발 절차를 순서대로 옳게 나열한 것은?,,행동기준고과법 개발위원회 구성 → 중요사건의 열거 → 중요사건의 범주화 → 중요사건의 재분류 → 중요사건의 등급화 → 확정 및 실시,행동기준고과법 개발위원회 구성 → 중요사건의 열거 → 중요사건의 범주화 → 중요사건의 등급화 → 중요사건의 재분류 → 확정 및 실시,행동기준고과법 개발위원회 구성 → 중요사건의 열거 → 중요사건의 등급화 → 중요사건의 재분류 → 중요사건의 범주화 → 확정 및 실시,행동기준고과법 개발위원회 구성 → 중요사건의 열거 → 중요사건의 등급화 → 중요사건의 범주화 → 중요사건의 재분류 → 확정 및 실시,행동기준고과법 개발위원회 구성 → 중요사건의 열거 → 중요사건의 재분류 → 중요사건의 범주화 → 중요사건의 등급화 → 확정 및 실시,1
산업안전지도사,2014,1,기업진단·지도,52,"카플란(Kaplan)과 노턴(Norton)에 의해 개발된 균형성과표(BSC: balanced scorecard)의 운용체계는 4가지 관점에서 파생되는 핵심성공요인(KPI: key performance indicators)들의 유기적 인과관계로 구성되는데, 4가지 관점으로 모두 옳은 것은?",,"재무적 관점, 고객 관점, 외부 경쟁환경 관점, 학습·성장 관점","재무적 관점, 고객 관점, 내부 프로세스 관점, 학습·성장 관점","재무적 관점, 자재 관점, 외부 경쟁환경 관점, 학습·성장 관점","재무적 관점, 고객 관점, 외부 경쟁환경 관점, 직무표준 관점","재무적 관점, 자재 관점, 내부 프로세스 관점, 직무표준 관점",2
산업안전지도사,2014,1,기업진단·지도,53,"도요타생산방식(TPS: toyota production system)에서 낭비를 철저하게 제거하기 위한 방법으로 활용된 적시생산시스템(JIT: just in time)에 관한 설명으로 옳은 것만을 모두 고른 것은?\nㄱ. 기본적 요소는 간판(kanban)방식, 생산의 평준화, 생산준비시간의 단축과 대로트화, 작업 표준화, 설비배치와 단일기능공제도이다.\nㄴ. 오릭키(Orlicky)에 의하여 개발된 자재관리 및 재고통제기법으로, 종속수요품의 소요량과 소요시기를 결정하기 위한 시스템이다.\nㄷ. 자동화, 작업자의 라인정지 권한 부여, 안돈(andon), 오작동 방지, 5S의 활성화로 일관성 있는 고품질을 달성하고 있는 시스템이다.\nㄹ. 고객 주문에 의해 생산이 시작되며, 부품의 생산과 공급이 후속 공정의 필요에 의해 결정되는 풀(pull)시스템의 자재흐름 체계이다.\nㅁ. 생산준비비용(주문비용)과 재고유지비용의 균형점에서 로트 크기(lot size)를 결정하며, 로트 크기가 큰 것을 추구하는 시스템이다.",,"ㄱ, ㄹ","ㄴ, ㅁ","ㄷ, ㄹ","ㄱ, ㄷ, ㄹ","ㄴ, ㄷ, ㅁ",3
산업안전지도사,2014,1,기업진단·지도,54,혁신적인 품질개선을 목적으로 개발된 기업 경영전략인 6시그마 프로젝트 수행단계(DMAIC)에 관한 설명으로 옳지 않은 것은?,,정의(define): 문제점을 찾아내는 첫 단계,측정(measurement): 문제 수준을 계량화하는 단계,통합(integration): 원인과 대책을 통합하는 단계,분석(analysis): 상태 파악과 원인분석을 하는 단계,관리(control): 관리계획을 실행하는 단계,3
산업안전지도사,2014,1,기업진단·지도,55,"생산시스템을 설계하고 계획, 통제하는 초기단계로 총괄생산계획(APP: aggregate production planning), 주생산일정계획(MPS: master production schedule), 자재소요계획(MRP: material requirement planning) 등에 기초자료로 활용되는 수요예측(demand forecasting) 방법에 관한 설명으로 옳지 않은 것은?",,"패널법(panel consensus)은 다양한 계층의 지식과 경험을 기초로 하고, 관련 예측정보를 공유한다.","소비자조사법(market research)은 설문지 및 전화에 의한 조사, 시험판매 등을 활용하여 예측한다.",단순이동평균법(simple moving average method)의 예측값은 과거 n 기간 동안 실제 수요의 산술평균을 활용한다.,시계열분해법(time series method)은 시계열을 4가지 구성요소로 분해하여 수요를 예측하는 방법이다.,델파이법(delphi method)은 설득력 있는 특정인에 의해 예측결과가 영향을 받는 장점이 존재한다.,5
산업안전지도사,2014,1,기업진단·지도,56,단체교섭의 절차에 관한 설명으로 옳지 않은 것은?,,노사간의 교섭안을 차례로 제시하고 대응하며 양측에 요구사항을 수시로 수정해야 협상이 가능하다.,노사간의 교섭과정에서 끝까지 타협이 안 된다면 정부나 제3자의 조정 및 중재가 필요하다.,노사간의 협상내용이 타결되면 단체협약서를 작성하고 협약내용을 관리할 필요가 있다.,사용자가 파업근로자 대신 임시직을 채용하거나 비조합원들을 파업 장소로 이동시켜 대체할 수 있다.,노사간의 협상이 결렬되면 양측은 서로에 대해 파업과 직장폐쇄 등으로 실력을 행사할 수 있다.,4
산업안전지도사,2014,1,기업진단·지도,57,"기능별 조직과 프로젝트(project) 팀조직을 결합시킨 형태의 조직으로, 1명의 직원이 2명 이상의 상사로부터 명령을 받을 수 있어 명령통일의 원칙(principle of unity command)에 혼란을 겪을 수 있는 조직구조는?",,매트릭스 조직,사업부제 조직,네트워크 조직,가상네트워크 조직,가상 조직,1
산업안전지도사,2014,1,기업진단·지도,58,리더십 이론에 관한 설명으로 옳은 것은?,,"행동이론 중 미시간 대학의 연구에서 직무중심 리더는 부하의 인간적 측면에 관심을 갖고, 종업원중심 리더는 부하의 업무에 관심을 갖고 있다는 것을 규명하였다.","상황이론 중 경로 - 목표 이론에서는 리더행동을 지시적 리더십, 지원적 리더십, 참여적 리더십, 성취지향적 리더십으로 분류하였다.",특성이론에서는 여러 특성을 가진 리더가 모든 상황에서 효과적이라고 주장하였다.,행동이론 중 오하이오 주립대학의 연구에서 배려하는 리더와 부하 사이의 관계는 상호신뢰를 형성하기가 어렵다는 것을 규명하였다.,상황이론 중 규범모형은 기본적으로 부하들이 의사결정에 참여하는 정도가 상황의 특성에 맞게 달라질 필요가 없다고 가정하였다.,2
산업안전지도사,2014,1,기업진단·지도,59,조직문화의 순기능에 관한 설명으로 옳지 않은 것은?,,조직구성원들에게 일체감을 조성한다.,조직구성원들의 생각과 행동지침이나 규범을 제공한다.,조직의 안정성과 계속성을 갖게 한다.,조직구성원들에게 획일성을 갖게 한다.,조직구성원들의 태도와 행동을 통제하는 기제(mechanism) 기능을 한다.,4
산업안전지도사,2014,1,기업진단·지도,60,'신입사원 선발시험점수(예측점수)와 업무성과(준거점수)의 상관계수가 0.4이다.'의 설명으로 옳은 것은?,,선발시험점수가 업무성과 변량의 16 %를 설명한다.,입사 지원자의 16 %가 합격할 것이다.,선발시험점수가 업무성과 변량의 40 %를 설명한다.,입사 지원자의 40 %가 합격할 것이다.,입사 지원자의 선발시험점수가 40점 이상일 경우 합격한다.,1
산업안전지도사,2014,1,기업진단·지도,61,직무분석(job analysis)에 관한 설명으로 옳은 것은?,,"직무분석이란 특정한 직무의 내용과 그 직무를 수행하기 위해서 필요한 요건을 분석하고 조사하는 것이며, 직무분석의 결과물은 급여명세서와 직무명세서이다.","직무기술서는 직무수행에 대한 정보를 담고 있으며, 직무의 내용, 직무수행 방법, 요구되는 기능, 지식, 능력 등의 정보를 포함하고 있다.","직무명세서는 직무 그 자체에 대한 정보를 담고 있으며, 직무수행에 요구되는 교육수준, 경험, 훈련 정도 등의 정보를 포함하고 있다.",직무기술서에는 보상정보 및 동기요인 등 직무만족과 관련된 정보가 포함된다.,직무분석의 방법 중 직무성과법(job performance method)은 직무분석가가 실제로 해당 직무를 수행하면서 직무에 관한 정보를 얻는 방법이다.,1
산업안전지도사,2014,1,기업진단·지도,62,교육훈련의 종류에 관한 설명으로 옳은 것은?,,"OJT(on the job training)는 자기발전 계획, 감수성 훈련(ST), 특강, 집단토의법 등을 활용한 훈련이다.","Off JT(off the job training)는 코칭, 인턴십, 직무순환 등을 활용하여 훈련한다.",LCD(learning company declaration)는 조직을 학습하는 시스템으로 변화시키자는 기법으로 학습조직선언의 방법이다.,MTP(management training program)는 강의식을 탈피하여 회의식 방법에 의한 훈련의 방법이다.,TWI(training within industry)는 미국 경제협력처(ECA)가 미국기업의 관리자를 대상으로 과학적 관리방법을 체계화한 정형적 훈련의 방법이다.,4
산업안전지도사,2014,1,기업진단·지도,63,인지적 정보처리의 단계를 순서대로 옳게 나열한 것은?\nㄱ. 반응실행\nㄴ. 반응선택\nㄷ. 감각\nㄹ. 지각\nㅁ. 기억,,ㄷ - ㄹ - ㅁ - ㄴ - ㄱ,ㄷ - ㄹ - ㄴ - ㅁ - ㄱ,ㄷ - ㅁ - ㄴ - ㄹ - ㄱ,ㄹ - ㅁ - ㄷ - ㄴ - ㄱ,ㄹ - ㄷ - ㅁ - ㄱ - ㄴ,3
산업안전지도사,2014,1,기업진단·지도,64,지각대조 효과(perceptual contrast effect)에 관한 설명으로 옳은 것은?,,지각되는 대상의 외양이나 속성 때문에 주의를 기울이지 않으려 하는 현상이다.,대상의 어떤 특성으로 사람에 대한 전반적인 인상을 형성하는 현상이다.,자신에게 내재된 특성이 타인에게도 있다고 믿는 현상이다.,"자신이 속해 있는 집단의 시각으로 다른 집단 구성원의 가치, 행동양식, 규범을 평가하는 현상이다.",어떤 사람을 직전에 만난 사람의 특성과 비교하여 평가하게 되는 현상이다.,5
산업안전지도사,2014,1,기업진단·지도,65,불안전한 행동의 심리적 원인에 관한 설명으로 옳지 않은 것은?,,동료에게 뒤처지지 않으려는 집단심리에서 발생하는 경쟁심리는 불안전한 행동의 원인이 될 수 있다.,자신의 능력을 지나치게 과신하거나 감독자의 눈을 의식해서 작업을 서두르면 불안전한 행동의 원인이 될 수 있다.,일에 대한 흥미를 상실하여 안이한 정서 상태가 될 경우 불안전한 행동의 원인이 될 수 있다.,곤란하고 어려운 작업에 대한 대기심은 자기 본연의 작업에 집중하게 되어 불안전한 행동의 원인이 아닌 안전행동의 원인이 될 수 있다.,작업경험의 증가에 따라 작업에 대한 감각의 둔화가 일어날 경우 불안전한 행동의 원인이 될 수 있다.,2
산업안전지도사,2014,1,기업진단·지도,66,안전보건관리 측면에서 안전점검의 종류에 관한 설명으로 옳은 것은?,,"일상점검은 작업책임자가 자기담당 직장 내에서 매일 생산공정, 설비 등에 대하여 실시하는 점검이다.",정기점검은 해당 분야에 정통한 안전보건관리자가 안전보건 운영상태 및 설비의 작동 상태 등에 대하여 연 1회 실시하는 점검이다.,중점점검은 안전보건상 문제의 소지가 있는 특정 위치나 시설물에 대하여 연 1회 실시하는 점검이다.,"수시점검은 사고발생, 노사분규, 가동중지 후 재가동 등의 돌발 사태에 의해 필요시 실시하는 점검이다.","특별점검은 기상이변, 계절, 특정기간, 경영층 방문 등에 따라 실시하는 점검이다.",4
