Test Name,Year,Session,Subject,Number,Question,Question_image,Option 1,Option 2,Option 3,Option 4,Option 5,Answer
산업안전지도사,2021,1,산업안전보건법령,1,산업안전보건법령상 안전보건관리체제에 관한 설명으로 옳지 않은 것은?,,안전보건관리책임자는 안전관리자와 보건관리자를 지휘ㆍ감독한다.,사업주는 사업장을 실질적으로 총괄하여 관리하는 사람에게 해당 사업장의 작업환경측정 등 작업환경의 점검 및 개선에 관한 업무를 총괄하여 관리하도록 하여야 한다.,사업주는 안전관리자에게 산업 안전 및 보건에 관한 업무로서 해당작업에서 발생한 산업재해에 관한 보고 및 이에 대한 응급조치에 관한 업무를 수행하도록 하여야 한다.,"사업주는 안전보건관리책임자가「산업안전보건법」에 따른 업무를 원활하게 수행할 수 있도록 권한ㆍ시설ㆍ장비ㆍ예산, 그 밖에 필요한 지원을 해야 한다.",사업주는 안전보건관리책임자를 선임했을 때에는 그 선임 사실 및「산업안전보건법」에 따른 업무의 수행내용을 증명할 수 있는 서류를 갖추어 두어야 한다.,3
산업안전지도사,2021,1,산업안전보건법령,2,산업안전보건법령상 협조 요청 등에 관한 설명으로 옳지 않은 것은?,,고용노동부장관은 산업재해 예방에 관한 기본계획을 효율적으로 시행하기 위하여 필요하다고 인정할 때에는「공공기관의 운영에 관한 법률」에 따른 공공기관의 장에게 필요한 협조를 요청할 수 있다.,고용노동부를 제외한 행정기관의 장은 사업장의 안전 및 보건에 관하여 규제를 하려면 미리 고용노동부장관과 협의하여야 한다.,고용노동부장관은 산업재해 예방을 위하여 필요하다고 인정할 때에는 사업주단체에게 필요한 사항을 권고하거나 협조를 요청할 수 있다.,고용노동부장관은 산업재해 예방을 위하여 중앙행정기관의 장과 지방자치단체의 장 또는 공단 등 관련 기관ㆍ단체의 장에게「소득세법」에 따른 납세실적에 관한 정보의 제공을 요청할 수 있다.,고용노동부장관은 산업재해 예방을 위하여 중앙행정기관의 장과 지방자치단체의 장 또는 공단 등 관련 기관ㆍ단체의 장에게「고용보험법」에 따른 근로자의 피보험자격의 취득 및 상실 등에 관한 정보의 제공을 요청할 수 있다.,4
산업안전지도사,2021,1,산업안전보건법령,3,산업안전보건법령상 사업주가 산업안전보건위원회의 심의ㆍ의결을 거쳐야 하는 사항을 모두 고른 것은?\n\nㄱ. 안전장치 및 보호구 구입 시 적격품 여부 확인에 관한 사항\nㄴ. 작업환경측정 등 작업환경의 점검 및 개선에 관한 사항\nㄷ. 산업재해의 원인 조사 및 재발 방지대책 수립에 관한 사항 중 중대재해에 관한 사항\nㄹ. 유해하거나 위험한 기계ㆍ기구ㆍ설비를 도입한 경우 안전 및 보건 관련 조치에 관한 사항,,ㄱ,"ㄱ, ㄴ","ㄷ, ㄹ","ㄴ, ㄷ, ㄹ","ㄱ, ㄴ, ㄷ, ㄹ",4
산업안전지도사,2021,1,산업안전보건법령,4,산업안전보건법령상 산업재해발생건수등의 공표대상 사업장에 해당하는 것은?,,사망재해자가 연간 1명 이상 발생한 사업장,사망만인율(연간 상시근로자 1만명당 발생하는 사망재해자 수의 비율)이 규모별 같은 업종의 평균 사망만인율 이상인 사업장,「산업안전보건법」에 따른 중대재해가 발생한 사업장,"산업재해 발생 사실을 은폐했거나, 은폐할 우려가 있는 사업장",「산업안전보건법」에 따른 산업재해의 발생에 관한 보고를 최근 3년 이내 1회 이상 하지 않은 사업장,2
산업안전지도사,2021,1,산업안전보건법령,5,산업안전보건법령상 안전보건관리규정에 관한 설명으로 옳은 것은?,,"사업주는 안전보건관리규정을 작성해야 할 사유가 발생한 날부터 30일 이내에, 이를 변경할 사유가 발생한 경우에는 15일 이내에 안전보건관리규정을 작성해야 한다.",사업주가 안전보건관리규정을 작성할 때에는 소방ㆍ가스ㆍ전기ㆍ교통 분야 등의 다른 법령에서 정하는 안전관리에 관한 규정과 통합하여 작성해서는 안 된다.,안전보건관리규정이 단체협약에 반하는 경우 안전보건관리규정으로 정한 기준에 따른다.,산업안전보건위원회가 설치되어 있지 아니한 사업장의 경우에는 사업주가 안전보건관리규정을 작성하거나 변경할 때에 근로자대표의 동의를 받아야 한다.,안전보건관리규정에는 안전 및 보건에 관한 관리조직에 관한 사항은 포함되지 않는다.,4
산업안전지도사,2021,1,산업안전보건법령,6,산업안전보건법령상 사업주의 의무 사항에 해당하는 것은?,,산업 안전 및 보건 정책의 수립 및 집행,해당 사업장의 안전 및 보건에 관한 정보를 근로자에게 제공,산업재해에 관한 조사 및 통계의 유지ㆍ관리,산업 안전 및 보건 관련 단체 등에 대한 지원 및 지도ㆍ감독,산업 안전 및 보건에 관한 의식을 북돋우기 위한 홍보ㆍ교육 등 안전문화 확산 추진,2
산업안전지도사,2021,1,산업안전보건법령,7,산업안전보건법령상 자율검사프로그램에 따른 안전검사를 할 수 있는 검사원의 자격을 갖추지 못한 사람은?,,「국가기술자격법」에 따른 기계ㆍ전기ㆍ전자ㆍ화공 또는 산업안전 분야에서 기사 이상의 자격을 취득한 후 해당 분야의 실무경력이 4년인 사람,「국가기술자격법」에 따른 기계ㆍ전기ㆍ전자ㆍ화공 또는 산업안전 분야에서 산업기사 이상의 자격을 취득한 후 해당 분야의 실무경력이 6년인 사람,「초ㆍ중등교육법」에 따른 고등학교ㆍ고등기술학교에서 기계ㆍ전기 또는 전자ㆍ화공 관련 학과를 졸업한 후 해당 분야의 실무경력이 6년인 사람,「고등교육법」에 따른 학교 중 수업연한이 4년인 학교에서 기계ㆍ전기ㆍ전자ㆍ화공 또는 산업안전 분야의 관련 학과를 졸업한 후 해당 분야의 실무경력이 4년인 사람,「국가기술자격법」에 따른 기계ㆍ전기ㆍ전자ㆍ화공 또는 산업안전 분야에서 기능사 이상의 자격을 취득한 후 해당 분야의 실무경력이 8년인 사람,3
산업안전지도사,2021,1,산업안전보건법령,8,산업안전보건법령상 용어에 관한 설명으로 옳지 않은 것은?,,건설공사발주자는 도급인에 해당한다.,근로자의 과반수로 조직된 노동조합이 없는 경우에는 근로자의 과반수를 대표하는 자를 근로자대표로 한다.,노무를 제공하는 사람이 업무에 관계되는 설비에 의하여 질병에 걸리는 것은 산업재해에 해당한다.,"명칭에 관계없이 물건의 제조ㆍ건설ㆍ수리 또는 서비스의 제공, 그 밖의 업무를 타인에게 맡기는 계약은 도급이다.",산업재해 중 3개월 이상의 요양이 필요한 부상자가 동시에 2명 이상 발생한 재해는 중대재해에 해당한다.,1
산업안전지도사,2021,1,산업안전보건법령,9,"산업안전보건법령상 안전보건관리책임자에 대한 신규교육 및 보수교육의 교육시간이 옳게 연결된 것은? (단, 다른 면제조건이나 감면조건을 고려하지 않음)",,"신규교육 : 6시간 이상, 보수교육 : 6시간 이상","신규교육 : 10시간 이상, 보수교육 : 6시간 이상","신규교육 : 10시간 이상, 보수교육 : 10시간 이상","신규교육 : 24시간 이상, 보수교육 : 10시간 이상","신규교육 : 34시간 이상, 보수교육 : 24시간 이상",1
산업안전지도사,2021,1,산업안전보건법령,10,산업안전보건법령상 물질안전보건자료의 작성·제출 제외 대상 화학물질 등에 해당하지 않는 것은?,,「마약류 관리에 관한 법률」에 따른 마약 및 향정신성의약품,「사료관리법」에 따른 사료,「생활주변방사선 안전관리법」에 따른 원료물질,「약사법」에 따른 의약품 및 의약외품,「방위사업법」에 따른 군수품,5
산업안전지도사,2021,1,산업안전보건법령,11,산업안전보건법령상 안전인증대상기계등이 아닌 유해ㆍ위험기계등으로서 자율안전확인대상기계등에 해당하는 것이 아닌 것은?,,휴대형이 아닌 연삭기(硏削機),파쇄기 또는 분쇄기,용접용 보안면,자동차정비용 리프트,식품가공용 제면기,3
산업안전지도사,2021,1,산업안전보건법령,12,산업안전보건법령상 안전보건교육 교육대상별 교육내용 중 근로자 정기교육에 해당하지 않는 것은?,,관리감독자의 역할과 임무에 관한 사항,산업보건 및 직업병 예방에 관한 사항,산업안전보건법령 및 산업재해보상보험 제도에 관한 사항,직무스트레스 예방 및 관리에 관한 사항,산업안전 및 사고 예방에 관한 사항,1
산업안전지도사,2021,1,산업안전보건법령,13,산업안전보건법령상 도급인 및 그의 수급인 전원으로 구성된 안전 및 보건에 관한 협의체에서 협의해야 하는 사항이 아닌 것은?,,작업의 시작 시간,작업의 종료 시간,작업 또는 작업장 간의 연락방법,재해발생 위험이 있는 경우 대피방법,사업주와 수급인 또는 수급인 상호 간의 연락 방법 및 작업공정의 조정,2
산업안전지도사,2021,1,산업안전보건법령,14,산업안전보건법령상 유해하거나 위험한 기계ㆍ기구ㆍ설비로서 안전검사대상기계등에 해당하는 것은?,,정격 하중 1톤인 크레인,이동식 국소 배기장치,밀폐형 구조의 롤러기,가정용 원심기,산업용 로봇,5
산업안전지도사,2021,1,산업안전보건법령,15,산업안전보건법령상 유해성·위험성 조사 제외 화학물질에 해당하는 것을 모두 고른 것은?\n\nㄱ. 원소\nㄴ. 천연으로 산출되는 화학물질\nㄷ. 「총포ㆍ도검ㆍ화약류 등의 안전관리에 관한 법률」에 따른 화약류\nㄹ. 「생활화학제품 및 살생물제의 안전관리에 관한 법률」에 따른 살생물물질 및 살생물제품\nㅁ. 「폐기물관리법」에 따른 폐기물,,ㄴ,"ㄱ, ㅁ","ㄷ, ㄹ, ㅁ","ㄱ, ㄴ, ㄷ, ㄹ","ㄱ, ㄴ, ㄷ, ㄹ, ㅁ",4
산업안전지도사,2021,1,산업안전보건법령,16,"산업안전보건법령상 기계등 대여자의 유해·위험 방지 조치로서 타인에게 기계등을 대여하는 자가 해당 기계등을 대여받은 자에게 서면으로 발급해야 할 사항을 모두 고른 것은?\n\nㄱ. 해당 기계등의 성능 및 방호조치의 내용\nㄴ. 해당 기계등의 특성 및 사용 시의 주의사항\nㄷ. 해당 기계등의 수리ㆍ보수 및 점검 내역과 주요 부품의 제조일\nㄹ. 해당 기계등의 정밀진단 및 수리 후 안전점검 내역, 주요 안전부품의 교환이력 및 제조일",,"ㄱ, ㄹ","ㄴ, ㄷ","ㄷ, ㄹ","ㄱ, ㄴ, ㄷ","ㄱ, ㄴ, ㄷ, ㄹ",5
산업안전지도사,2021,1,산업안전보건법령,17,"산업안전보건기준에 관한 규칙상 사업주가 사다리식 통로 등을 설치하는 경우 준수해야 하는 사항으로 옳지 않은 것은? (단, 잠함(潛函) 및 건조·수리중인 선박의 경우는 아님)",,발판과 벽과의 사이는 15센티미터 이상의 간격을 유지할 것,폭은 30센티미터 이상으로 할 것,사다리식 통로의 길이가 10미터 이상인 경우에는 5미터 이내마다 계단참을 설치할 것,고정식 사다리식 통로의 기울기는 75도 이하로 하고 그 높이가 5미터 이상인 경우에는 바닥으로부터 높이가 2미터 되는 지점부터 등받이울을 설치할 것,사다리의 상단은 걸쳐놓은 지점으로부터 60센티미터 이상 올라가도록 할 것,4
산업안전지도사,2021,1,산업안전보건법령,18,산업안전보건기준에 관한 규칙상 사업주가 작업장에 비상구가 아닌 출입구를 설치하는 경우 준수해야 하는 사항으로 옳지 않은 것은?,,"출입구의 위치, 수 및 크기가 작업장의 용도와 특성에 맞도록 할 것",출입구에 문을 설치하는 경우에는 근로자가 쉽게 열고 닫을 수 있도록 할 것,주된 목적이 하역운반기계용인 출입구에는 인접하여 보행자용 출입구를 따로 설치할 것,하역운반기계의 통로와 인접하여 있는 출입구에서 접촉에 의하여 근로자에게 위험을 미칠 우려가 있는 경우에는 비상등ㆍ비상벨 등 경보장치를 할 것,"출입구에 문을 설치하지 아니한 경우로서 계단이 출입구와 바로 연결된 경우, 작업자의 안전한 통행을 위하여 그 사이에 1.5미터 이상 거리를 둘 것",5
산업안전지도사,2021,1,산업안전보건법령,19,산업안전보건법령상 사업주가 보존해야 할 서류의 보존기간이 2년인 것은?,,노사협의체의 회의록,안전보건관리책임자의 선임에 관한 서류,화학물질의 유해성·위험성 조사에 관한 서류,산업재해의 발생 원인 등 기록,작업환경측정에 관한 서류,1
산업안전지도사,2021,1,산업안전보건법령,20,산업안전보건법령상 일반건강진단을 실시한 것으로 인정되는 건강진단에 해당하지 않는 것은?,,「국민건강보험법」에 따른 건강검진,「선원법」에 따른 건강진단,「진폐의 예방과 진폐근로자의 보호 등에 관한 법률」에 따른 정기 건강진단,「병역법」에 따른 신체검사,「항공안전법」에 따른 신체검사,4
산업안전지도사,2021,1,산업안전보건법령,21,산업안전보건법령상 작업환경측정기관에 관한 지정 요건을 갖추면 작업환경측정기관으로 지정받을 수 있는 자를 모두 고른 것은?\n\nㄱ. 국가 또는 지방자치단체의 소속기관\nㄴ. 「의료법」에 따른 종합병원 또는 병원\nㄷ. 「고등교육법」에 따른 대학 또는 그 부속기관\nㄹ. 작업환경측정 업무를 하려는 법인,,"ㄱ, ㄴ","ㄷ, ㄹ","ㄱ, ㄴ, ㄷ","ㄴ, ㄷ, ㄹ","ㄱ, ㄴ, ㄷ, ㄹ",5
산업안전지도사,2021,1,산업안전보건법령,22,산업안전보건법령상 사업주가 작성하여야 할 공정안전보고서에 포함되어야 할 내용으로 옳지 않은 것은?,,공정안전자료,산업재해 예방에 관한 기본계획,안전운전계획,비상조치계획,공정위험성 평가서,2
산업안전지도사,2021,1,산업안전보건법령,23,산업안전보건법령상 산업안전지도사에 관한 설명으로 옳지 않은 것은?,,산업안전지도사는 산업보건에 관한 조사ㆍ연구의 직무를 수행한다.,산업안전지도사는 유해·위험의 방지대책에 관한 평가·지도의 직무를 수행한다.,산업안전지도사의 업무 영역은 기계안전·전기안전·화공안전·건설안전 분야로 구분한다.,산업안전지도사가 직무를 수행하려는 경우에는 고용노동부령으로 정하는 바에 따라 고용노동부장관에게 등록하여야 한다.,「산업안전보건법」을 위반하여 벌금형을 선고받고 1년이 지나지 아니한 사람은 산업안전지도사 직무수행을 위해 고용노동부장관에게 등록을 할 수 없다.,1
산업안전지도사,2021,1,산업안전보건법령,24,산업안전보건법령상 역학조사 및 자격 등에 의한 취업제한 등에 관한 설명으로 옳지 않은 것은?,,사업주는 유해하거나 위험한 작업으로 상당한 지식이나 숙련도가 요구되는 고용노동부령으로 정하는 작업의 경우 그 작업에 필요한 자격·면허·경험 또는 기능을 가진 근로자가 아닌 사람에게 그 작업을 하게 해서는 아니된다.,"사업주 및 근로자는 고용노동부장관이 역학조사를 실시하는 경우 적극 협조하여야 하며, 정당한 사유없이 역학조사를 거부·방해하거나 기피해서는 아니 된다.",한국산업안전보건공단이 업무상 질병 여부의 결정을 위하여 역학조사를 요청하는 경우 근로복지공단은 역학조사를 실시하여야 한다.,"고용노동부장관은 역학조사를 위하여 필요하면「산업안전보건법」에 따른 근로자의 건강진단결과,「국민건강보험법」에 따른 요양급여기록 및 건강검진 결과,「고용보험법」에 따른 고용정보,「암관리법」에 따른 질병정보 및 사망원인정보 등을 관련 기관에 요청할 수 있다.",유해하거나 위험한 작업으로 상당한 지식이나 숙련도가 요구되는 고용노동부령으로 정하는 작업의 경우 고용노동부장관은 자격ㆍ면허의 취득 또는 근로자의 기능 습득을 위하여 교육기관을 지정할 수 있다.,3
산업안전지도사,2021,1,산업안전보건법령,25,산업안전보건법령상 유해하거나 위험한 작업에 해당하여 근로조건의 개선을 통하여 근로자의 건강보호를 위한 조치를 하여야 하는 작업을 모두 고른 것은?\n\nㄱ. 동력으로 작동하는 기계를 이용하여 중량물을 취급하는 작업\nㄴ. 갱(坑) 내에서 하는 작업\nㄷ. 강렬한 소음이 발생하는 장소에서 하는 작업,,ㄱ,ㄴ,ㄷ,"ㄱ, ㄷ","ㄴ, ㄷ",5
산업안전지도사,2021,1,산업안전일반,26,TWI(Training Within Industry)의 교육훈련내용이 아닌 것은?,,작업적응훈련(JAT),작업방법훈련(JMT),작업안전훈련(JST),작업지도훈련(JIT),인간관계훈련(JRT),1
산업안전지도사,2021,1,산업안전일반,27,"다음 ( )에 들어갈 것으로 옳은 것은?\n\n( )는 330건의 사고가 발생하는 가운데 중상 또는 사망 1건, 경상 29건, 무상해 사고 300건의 비율로 재해가 발생한다는 법칙을 주장하였다.",,버드(F. Bird),아담스(E. Adams),시몬즈(R. Simonds),하인리히(H. Heinrich),콤페스(P. Compes),4
산업안전지도사,2021,1,산업안전일반,28,안전관리 조직에 관한 내용으로 옳지 않은 것은?,,라인스태프형은 명령 계통과 조언ㆍ권고적 참여가 혼돈되기 쉬운 단점이 있다.,"라인형은 1,000명 이상의 대규모 사업장에 주로 활용된다.",라인형은 안전에 대한 지시 및 전달이 비교적 신속하다.,스태프형은 권한다툼이나 조정 때문에 라인형 보다 통제수속이 복잡하며 시간과 노력이 더 소모된다.,"안전관리 조직 형태는 라인형(Line type), 스태프형(Staff type), 라인스태프형(Line-Staff type)으로 구분할 수 있다.",2
산업안전지도사,2021,1,산업안전일반,29,보호구 안전인증 고시에서 정하고 있는 추락 및 감전 위험방지용 안전모의 성능기준에 관한 내용 중 안전모의 시험성능기준 항목이 아닌 것은?,,내관통성,충격흡수성,내약품성,턱끈풀림,내수성,3
산업안전지도사,2021,1,산업안전일반,30,산업안전보건법령상 대여자 등이 안전조치 등을 해야 하는 기계ㆍ기구ㆍ설비 및 건축물 등에 해당하는 것을 모두 고른 것은?\n\nㄱ. 타워크레인  ㄴ. 이동식 크레인  ㄷ. 고소작업대  ㄹ. 리프트,,"ㄱ, ㄴ","ㄷ, ㄹ","ㄱ, ㄴ, ㄹ","ㄴ, ㄷ, ㄹ","ㄱ, ㄴ, ㄷ, ㄹ",5
산업안전지도사,2021,1,산업안전일반,31,'미끄러운 기름이 흘러있는 복도 위를 걷다가 미끄러지면서 넘어져 기계에 머리를 부딪쳐서 다쳤다.' 이러한 재해상황에 관한 내용으로 옳은 것은?,,"가해물: 복도, 기인물: 기름, 사고유형: 추락","가해물: 기름, 기인물: 복도, 사고유형: 끼임","가해물: 기계, 기인물: 기름, 사고유형: 전도","가해물: 기름, 기인물: 기계, 사고유형: 화재","가해물: 기계, 기인물: 기름, 사고유형: 감전",3
산업안전지도사,2021,1,산업안전일반,32,공기 중 연소(폭발)범위가 가장 넓은 것은?,,수소,암모니아,프로판,에탄,메탄,1
산업안전지도사,2021,1,산업안전일반,33,"비행기로부터 30 m 떨어진 곳에서의 음압이 140 dB이라면, 300 m 떨어진 곳에서의 음압은 몇 dB 인가? (단, 조건은 동일하다.)",,90,100,110,120,130,4
산업안전지도사,2021,1,산업안전일반,34,사업장 위험성평가에 관한 지침에서 정하고 있는 위험성평가의 절차에서 '상시근로자수가 20명 미만 사업장(총 공사금액 20억원 미만의 건설공사)의 경우'에 생략할 수 있는 절차는?,,평가대상의 선정 등 사전준비,근로자의 작업과 관계되는 유해ㆍ위험요인의 파악,파악된 유해ㆍ위험요인별 위험성의 추정,위험성 감소대책의 수립 및 실행,위험성평가 실시내용 및 결과에 관한 기록,3
산업안전지도사,2021,1,산업안전일반,35,인간-기계체계의 신뢰도 유지방안 중 피드백 제어방식에 해당하는 것을 모두 고른 것은?\n\nㄱ. 서보 메커니즘(servo mechanism)\nㄴ. 프로세스 컨트롤(process control)\nㄷ. 오토매틱 레귤레이션(automatic regulation),,ㄱ,ㄴ,"ㄱ, ㄷ","ㄴ, ㄷ","ㄱ, ㄴ, ㄷ",5
산업안전지도사,2021,1,산업안전일반,36,학습평가 기본기준 4가지에 해당하지 않는 것은?,,타당성,신뢰성,객관성,실용성,주관성,5
산업안전지도사,2021,1,산업안전일반,37,CA(Criticality Analysis)기법에서 '작업의 실패로 이어질 염려가 있는 고장'의 카테고리는?,,카테고리-Ⅰ,카테고리-Ⅱ,카테고리-Ⅲ,카테고리-Ⅳ,카테고리-Ⅴ,2
산업안전지도사,2021,1,산업안전일반,38,"다음은 위험성평가 기법인 MORT에 관한 설명이다. ( )에 들어갈 것으로 옳은 것은?\n\nMORT는 ( )와(과) 동일한 논리방법을 사용하여 관리, 설계, 생산 및 보전 등의 넓은 범위에 걸친 안전 확보를 위하여 활용하는 기법으로 원자력 산업 등에 이용된다.",,HAZOP,FTA,CA,FMEA,PHA,2
산업안전지도사,2021,1,산업안전일반,39,"건구온도 42℃, 습구온도 32℃ 일 경우 Oxford지수는?",,33.5℃,35.5℃,37.5℃,38.5℃,40.5℃,1
산업안전지도사,2021,1,산업안전일반,40,화학물질 및 물리적 인자의 노출기준에서 제시된 소음의 노출기준(충격소음 제외)에 관한 일부내용이다. ( )에 들어갈 내용으로 옳은 것은?\n\n| 1일 노출시간(hr) | 소음강도 dB(A) |\n| 8 | ( ㄱ ) |\n| 4 | ( ㄴ ) |,,"ㄱ: 90, ㄴ: 95","ㄱ: 90, ㄴ: 100","ㄱ: 95, ㄴ: 100","ㄱ: 95, ㄴ: 105","ㄱ: 100, ㄴ: 100",1
산업안전지도사,2021,1,산업안전일반,41,"산업안전보건기준에 관한 규칙의 일부이다. ( )에 들어갈 내용으로 옳은 것은?\n\n제8조(조도) 사업주는 근로자가 상시 작업하는 장소의 작업면 조도(照度)를 다음 각 호의 기준에 맞도록 하여야 한다. 다만, 갱내(坑內) 작업장과 감광재료(感光材料)를 취급하는 작업장은 그러하지 아니하다.\n1. 초정밀작업: ( ㄱ )럭스(lux) 이상\n2. 정밀작업: ( ㄴ )럭스 이상",,"ㄱ: 600, ㄴ: 300","ㄱ: 650, ㄴ: 250","ㄱ: 700, ㄴ: 200","ㄱ: 750, ㄴ: 300","ㄱ: 800, ㄴ: 250",4
산업안전지도사,2021,1,산업안전일반,42,브레인스토밍 기법에 관한 내용으로 옳은 것을 모두 고른 것은?\n\nㄱ. 타인의 아이디어를 비판하지 않을 것\nㄴ. 자유로운 분위기를 조성할 것\nㄷ. 타인의 아이디어에 내 아이디어를 덧붙여 아이디어를 제시하는 것은 금지할 것\nㄹ. 다수의 아이디어를 낼 수 있도록 할 것,,"ㄱ, ㄴ","ㄴ, ㄷ","ㄱ, ㄴ, ㄹ","ㄱ, ㄷ, ㄹ","ㄱ, ㄴ, ㄷ, ㄹ",3
산업안전지도사,2021,1,산업안전일반,43,일본의 의학자인 하시모토 쿠니에가 제시한 의식수준 5단계(Phase)의 의식상태와 신뢰성에 관한 내용으로 옳은 것은?,,Phase 0의 의식상태는 무의식 상태이며 신뢰성은 0.3이다.,Phase 1의 의식상태는 실신 상태이며 신뢰성은 0.6이상이다.,Phase 2의 의식상태는 의식이 둔한 상태이며 신뢰성은 0.9이다.,Phase 3의 의식상태는 명석한 상태이며 신뢰성은 0.999999이상이다.,Phase 4의 의식상태는 편안한 상태이며 신뢰성은 1.0이다.,4
산업안전지도사,2021,1,산업안전일반,44,다음은 푸르키네 효과(Purkinje Effect)에 관한 내용이다. ( )에 들어갈 내용으로 옳은 것은?\n\n○ 색의 식별은 암순응과 명순응으로 나누어지고 우리 눈의 망막에는 추상체와 간상체라는 두 종류의 시신경이 있는데 추상체는 ( ㄱ )을(를) 주로 느끼고 간상체는 ( ㄴ )을(를) 주로 느낀다.\n○ ( ㄷ )된 눈의 최대비시감도는 약 555 nm이고 ( ㄹ )된 눈의 최대비시감도는 약 510 nm로서 짧은 파장으로 이동한다.,,"ㄱ: 색상, ㄴ: 명암, ㄷ: 명순응, ㄹ: 암순응","ㄱ: 명암, ㄴ: 색상, ㄷ: 암순응, ㄹ: 명순응","ㄱ: 명암, ㄴ: 채도, ㄷ: 암순응, ㄹ: 명순응","ㄱ: 명암, ㄴ: 색상, ㄷ: 명순응, ㄹ: 암순응","ㄱ: 채도, ㄴ: 명암, ㄷ: 암순응, ㄹ: 명순응",1
