Test Name,Year,Session,Subject,Number,Question,Question_image,Option 1,Option 2,Option 3,Option 4,Option 5,Answer
산업안전지도사,2013,1,기업진단·지도,62,직무만족의 선행변인에 관한 설명으로 옳은 것은?,,통제소재에서 내재론자들은 외재론자들보다 자신들의 직무에 대해 더 만족한다.,직무특성과 직무만족간의 상관은 질문지로 측정한 연구에서는 나타나지 않았다.,집단주의적 아시아 문화권에서는 직무특성과 직무만족간에 상관이 높은 것으로 나타났다.,급여만족은 분배공정성보다 절차공정성이 더 밀접한 관련이 있다.,직무특성 차원과 직무만족간의 상관을 산출해 본 결과 직무만족과 가장 낮은 상관을 나타내는 직무특성은 기술 다양성이었다.,1
산업안전지도사,2013,1,기업진단·지도,63,작업자의 수행을 평가할 때 평가자에 의한 관대화 오류가 가장 많이 발생할 수 있는 방법은?,,종업원 순위법,강제배분법,도식적 평정법,정신운동능력 평정법,행동기준 평정법,3
산업안전지도사,2013,1,기업진단·지도,64,사회적 권력(social power)의 유형에 대한 설명으로 옳지 않은 것은?,,합법권력 : 상사의 직책에 고유하게 내재하는 권력,강압권력 : 상사가 징계 해고 등 부하를 처벌할 수 있는 능력,"보상권력 : 상사가 부하에게 수당, 승진 등 보상해 줄 수 있는 능력",전문권력 : 상사가 보유하고 있는 지식과 전문기술 등에 근거하는 능력,"참조권력 : 상사가 부하에게 규범과 명확한 지침을 전달하고, 문제발생 시 도움을 줄 수 있는 능력",5
산업안전지도사,2013,1,기업진단·지도,65,심리검사 결과를 분석할 때 상관계수를 이용하여 검증하는 타당도(validity)를 모두 고른 것은?\nㄱ. 구성 타당도\nㄴ. 내용 타당도\nㄷ. 준거관련 타당도\nㄹ. 수렴 타당도\nㅁ. 확산 타당도,,"ㄱ, ㄴ, ㄹ","ㄱ, ㄴ, ㅁ","ㄷ, ㄹ, ㅁ","ㄱ, ㄴ, ㄷ, ㄹ","ㄱ, ㄷ, ㄹ, ㅁ",5
산업안전지도사,2013,1,기업진단·지도,66,호프스테드(Hofstede)의 문화간 차이를 이해하는 4가지 차원에 속하지 않는 것은?,,불확실성 회피,개인주의-집합주의,남성성-여성성,신뢰-불신,세력차이,4
산업안전지도사,2013,1,기업진단·지도,67,작업장 스트레스의 대처방안 중 조직차원의 기법에 해당하는 것만을 모두 고른 것은?\nㄱ. 바이오 피드백\nㄴ. 작업 과부하의 제거\nㄷ. 사회적 지지의 제공\nㄹ. 이완훈련\nㅁ. 조직분위기 개선,,"ㄱ, ㄴ, ㄷ","ㄱ, ㄷ, ㄹ","ㄴ, ㄷ, ㅁ","ㄴ, ㄹ, ㅁ","ㄷ, ㄹ, ㅁ",3
산업안전지도사,2013,1,기업진단·지도,68,"A과장은 근무평정을 할 때 자신의 부하직원 B가 평소 성실하다는 이유로 자신이 직접 관찰하지 않아서 잘 모르는 B의 창의성, 도덕성, 기획력 등을 모두 높게 평가하였다. 이러한 경우 A과장은 어떤 평정오류를 범하고 있는가?",,관대화오류,후광오류,엄격화오류,중앙집중오류,대비오류,2
산업안전지도사,2013,1,기업진단·지도,69,우리나라와 세계적으로 널리 인용되고 있는 노출기준에 대해 명칭과 제정기관이 옳은 것만을 모두 고른 것은?\n| 보기 | 노출기준의 명칭 | 제정기관(국가) |\n| --- | --- | --- |\n| ㄱ | PEL | HSE(영국) |\n| ㄴ | REL | OSHA(미국) |\n| ㄷ | TLV | ACGIH(미국) |\n| ㄹ | WEEL | NIOSH(미국) |\n| ㅁ | 허용기준 | 고용노동부(대한민국) |,,"ㄱ, ㄴ","ㄱ, ㄷ","ㄷ, ㄹ","ㄷ, ㅁ","ㄹ, ㅁ",4
산업안전지도사,2013,1,기업진단·지도,70,다음 작업에서 발생하는 유해요인과 건강장애가 옳게 짝지어진 것은?,,유리가공작업 - 적외선 - 백내장(cataract),페인트칠작업 - 카드뮴 - 백혈병(leukemia),금속세척작업 - 노말헥산 - 진폐증(pneumoconiosis),굴착작업 - 진동 - 사구체신염(glomerular nephritis),목재가공작업 - 목분진 - 간혈관육종(hepatic angiosarcoma),1
산업안전지도사,2013,1,기업진단·지도,71,국소배기시스템에 관한 설명으로 옳은 것은?,,후드 개구면에서 유해물질까지의 거리를 가깝게 하면 필요환기량이 증가한다.,외부식 포집형 후드(capture type hood)의 제어속도를 측정하는 대표적인 기구는 피토관(pitot tube)이다.,후드에서 덕트로 공기가 유입될 때의 속도압이 같다면 유입계수(Ce)가 큰 후드일수록 후드정압이 더 커진다.,"베르누이 정리는 덕트내에서 유체가 흐를 때, 에너지 손실은 유체밀도, 유체의 속도 및 관의 직경에 비례하며, 유체의 점도에는 반비례한다는 것을 의미한다.",사업장에서 탈지제로 사용되는 사염화에틸렌에 대한 국소배기시스템을 설계할 때는 공기보다 비중이 높다는 점을 고려할 필요 없이 후드는 정상적으로 설치하면 된다.,5
산업안전지도사,2013,1,기업진단·지도,72,작업환경 측정방법에 관한 설명으로 옳은 것은?,,일반적으로 입자상 물질의 측정결과 단위는 mg/m³ 또는 ppm으로 표기한다.,시너와 같은 비극성 유기용제를 공기 중에서 시료채취하기 위해서는 실리카겔관을 매체로 사용한다.,일반적으로 실내에서 온열환경을 측정하기 위해서는 자연습구온도(NWBT)와 흑구온도(GT)만 측정한다.,작업장 근로자의 소음 노출수준을 측정하기 위해 사용하는 지시소음계는 'fast' 모드로 설정하여 측정하여야 한다.,MCE 여과지를 이용하여 석면을 포집하기 전·후에 실시하는 시료채취펌프의 유량보정을 실제보다 낮게 평가했다면 최종 측정결과인 공기 중 석면농도는 과소평가하게 된다.,3
산업안전지도사,2013,1,기업진단·지도,73,"축전지 제조 작업장에서 측정된 5개의 공기 중 카드뮴 시료의 농도가 0.02, 0.08, 0.05, 0.25, 0.01 mg/m³일 때, 다음 중 옳은 것은?",,측정치들은 정규분포를 하고 있다.,대표치는 노출기준을 초과하였다.,측정치의 변이가 너무 커서 재측정하여야 한다.,측정치의 대표치인 기하평균(GM)은 0.082 mg/m³이다.,측정치의 변이인 기하표준편차(GSD)는 약 0.098이다.,2
산업안전지도사,2013,1,기업진단·지도,74,유해인자별 건강장애에 관한 설명으로 옳은 것은?,,아세톤에 만성적으로 노출되면 다발성 신경염이 발생한다.,"크롬은 손톱 및 구강점막의 색소침착, 모공의 흑점화, 간장애를 일으킨다.","삼염화에틸렌은 스펀지의 원료로 사용되며, 화재시 치명적인 가스를 발생시켜 폐수종을 일으킨다.","라돈은 방사성 물질 중 유일한 기체상의 물질이며, 폐포나 기관지에 침착되어 β-입자를 방출한다.","납에 의한 건강상의 영향은 신경독성, 복통, 혈색소 합성이 저해되어 나타나는 빈혈 증상 등을 들 수 있다.",5
산업안전지도사,2013,1,기업진단·지도,75,산업위생과 관련된 설명 중 옳은 것은?,,작업환경 중 유해요인으로부터 근로자의 건강을 보호하기 위해 국제적으로 통일하여 제정한 노출기준은 MAK이다.,최근 사업장에 도입되고 있는 위험성 평가(risk assessment)는 산업위생 분야의 작업환경측정과는 관련성이 없는 제도라고 할 수 있다.,"산업위생은 근로자 개인위생을 기본으로 하고 있으며, 개인의 생활습관 및 체력관리를 통하여 건강을 유지·관리하는 것을 최우선으로 하고 있다.",산업위생의 궁극적 목적은 근로자의 건강을 보호하기 위한 대책을 강구하는 것으로 일반적인 대책의 우선순위는 제거-대체-공학적개선-행정적개선-개인보호구착용 순이다.,"작업환경 중 건강 유해요인은 크게 물리적, 화학적, 생물학적, 육체적 또는 정신적 부담 요인으로 나눌 수 있으며, 이중에서 산업위생분야는 정신적 부담 요인을 제외한 나머지를 관리대상으로 한다.",4
